04/08/2024,10.00,sale STRIPE-LDR51TQ6 txn_3Pk0hUGtEGgLrOja14iwK4Zf Outdoor Class North
04/08/2024,-0.35,fee STRIPE-LDR51TQ6 txn_3Pk0hUGtEGgLrOja14iwK4Zf Outdoor Class North
04/08/2024,10.00,sale STRIPE-LDR51TQ6 txn_3Pk0sgGtEGgLrOja1SIjTpTI Outdoor Class North
04/08/2024,-0.35,fee STRIPE-LDR51TQ6 txn_3Pk0sgGtEGgLrOja1SIjTpTI Outdoor Class North
05/08/2024,15.00,sale STRIPE-LDR51TQ6 txn_3PkOe3GtEGgLrOja1She4NIr Adult Decathlon
05/08/2024,-0.38,fee STRIPE-LDR51TQ6 txn_3PkOe3GtEGgLrOja1She4NIr Adult Decathlon
05/08/2024,15.00,sale STRIPE-LDR51TQ6 txn_3PkPTXGtEGgLrOja1NrN2wpV Adult Decathlon
05/08/2024,-0.43,fee STRIPE-LDR51TQ6 txn_3PkPTXGtEGgLrOja1NrN2wpV Adult Decathlon
05/08/2024,0.00,stripe debit STRIPE-VRRMZV5V po_1PirEzGtEGgLrOjamZzZBqkY
06/08/2024,0.00,stripe debit STRIPE-WEEONWZC po_1PjBSwGtEGgLrOjaHzSb1N2t
07/08/2024,60.00,sale STRIPE-HGBQSONI txn_3Pl7eCGtEGgLrOja0hOABZBE Private Booking
07/08/2024,-1.10,fee STRIPE-HGBQSONI txn_3Pl7eCGtEGgLrOja0hOABZBE Private Booking
07/08/2024,15.00,sale STRIPE-HGBQSONI txn_3PlAF4GtEGgLrOja0h9lpE8q Youth Class East 8-14
07/08/2024,-0.43,fee STRIPE-HGBQSONI txn_3PlAF4GtEGgLrOja0h9lpE8q Youth Class East 8-14
07/08/2024,0.00,stripe debit STRIPE-MKVOHPKM po_1PkHHwGtEGgLrOjaLWo85JTR
08/08/2024,0.00,stripe debit STRIPE-LDR51TQ6 po_1PkcxaGtEGgLrOja063czdyt
09/08/2024,10.00,sale STRIPE-CQSIAPBC txn_3Plq0RGtEGgLrOja1wbzDYlM Outdoor Class East
09/08/2024,-0.32,fee STRIPE-CQSIAPBC txn_3Plq0RGtEGgLrOja1wbzDYlM Outdoor Class East
09/08/2024,10.00,sale STRIPE-CQSIAPBC txn_3Plxl0GtEGgLrOja1SJRbxec Outdoor Class East
09/08/2024,-0.35,fee STRIPE-CQSIAPBC txn_3Plxl0GtEGgLrOja1SJRbxec Outdoor Class East
09/08/2024,10.00,sale STRIPE-CQSIAPBC txn_3Pm0gMGtEGgLrOja0NMg6gQF Outdoor Class East
09/08/2024,-0.35,fee STRIPE-CQSIAPBC txn_3Pm0gMGtEGgLrOja0NMg6gQF Outdoor Class East
09/08/2024,40.00,sale STRIPE-CQSIAPBC txn_3Pm0gzGtEGgLrOja1JBAJTKO custom
09/08/2024,-0.80,fee STRIPE-CQSIAPBC txn_3Pm0gzGtEGgLrOja1JBAJTKO custom
10/08/2024,10.00,sale STRIPE-YEIUUJ8B txn_3Pm9kcGtEGgLrOja0b1lIdvQ Outdoor Class East
10/08/2024,-0.35,fee STRIPE-YEIUUJ8B txn_3Pm9kcGtEGgLrOja0b1lIdvQ Outdoor Class East
10/08/2024,10.00,sale STRIPE-YEIUUJ8B txn_3PmAVZGtEGgLrOja0QaXP9WO Outdoor Class East
10/08/2024,-0.35,fee STRIPE-YEIUUJ8B txn_3PmAVZGtEGgLrOja0QaXP9WO Outdoor Class East
10/08/2024,10.00,sale STRIPE-YEIUUJ8B txn_3PmBAdGtEGgLrOja1d47S39v Outdoor Class East
10/08/2024,-0.35,fee STRIPE-YEIUUJ8B txn_3PmBAdGtEGgLrOja1d47S39v Outdoor Class East
10/08/2024,30.00,sale STRIPE-YEIUUJ8B txn_3PmE5NGtEGgLrOja1A8wwYOs Youth Class 6-9
10/08/2024,-0.56,fee STRIPE-YEIUUJ8B txn_3PmE5NGtEGgLrOja1A8wwYOs Youth Class 6-9
10/08/2024,50.00,sale STRIPE-YEIUUJ8B txn_3PmJRFGtEGgLrOja0JH5GZcg Gift Card 5
10/08/2024,-0.95,fee STRIPE-YEIUUJ8B txn_3PmJRFGtEGgLrOja0JH5GZcg Gift Card 5
10/08/2024,15.00,sale STRIPE-YEIUUJ8B txn_3PmLhiGtEGgLrOja1n0XeWvB Youth Class 10-14
10/08/2024,-0.43,fee STRIPE-YEIUUJ8B txn_3PmLhiGtEGgLrOja1n0XeWvB Youth Class 10-14
11/08/2024,15.00,sale STRIPE-YEIUUJ8B txn_3Pmb5CGtEGgLrOja1rl6DbJf Youth Class 10-14
11/08/2024,-0.69,fee STRIPE-YEIUUJ8B txn_3Pmb5CGtEGgLrOja1rl6DbJf Youth Class 10-14
12/08/2024,15.00,sale STRIPE-YEIUUJ8B txn_3PmwcGGtEGgLrOja1lCpUGrZ Adult Decathlon
12/08/2024,-0.43,fee STRIPE-YEIUUJ8B txn_3PmwcGGtEGgLrOja1lCpUGrZ Adult Decathlon
12/08/2024,15.00,sale STRIPE-YEIUUJ8B txn_3PmzlGGtEGgLrOja1HKgThcw Adult Decathlon
12/08/2024,-0.43,fee STRIPE-YEIUUJ8B txn_3PmzlGGtEGgLrOja1HKgThcw Adult Decathlon
12/08/2024,10.00,sale STRIPE-YEIUUJ8B txn_3Pn0ywGtEGgLrOja0ZXx93yE Adult Decathlon
12/08/2024,-0.35,fee STRIPE-YEIUUJ8B txn_3Pn0ywGtEGgLrOja0ZXx93yE Adult Decathlon
12/08/2024,15.00,sale STRIPE-YEIUUJ8B txn_3Pn1iNGtEGgLrOja0QbbLJl1 Adult Decathlon
12/08/2024,-0.43,fee STRIPE-YEIUUJ8B txn_3Pn1iNGtEGgLrOja0QbbLJl1 Adult Decathlon
12/08/2024,15.00,sale STRIPE-YEIUUJ8B txn_3Pn1iXGtEGgLrOja0DsA30n2 Adult Decathlon
12/08/2024,-0.43,fee STRIPE-YEIUUJ8B txn_3Pn1iXGtEGgLrOja0DsA30n2 Adult Decathlon
12/08/2024,0.00,stripe debit STRIPE-HGBQSONI po_1PlOp1GtEGgLrOjaIeguB5u3
13/08/2024,15.00,refund STRIPE-Y2UAXHDL txn_3PlAF4GtEGgLrOja04edaTd8 Youth Class East 8-14
13/08/2024,60.00,sale STRIPE-Y2UAXHDL txn_3PnJ3yGtEGgLrOja0IhZpT4y Private Booking
13/08/2024,-1.10,fee STRIPE-Y2UAXHDL txn_3PnJ3yGtEGgLrOja0IhZpT4y Private Booking
14/08/2024,15.00,sale STRIPE-6Y16DL2R txn_3PnhiaGtEGgLrOja17XTEj3W Youth Class East 8-14
14/08/2024,-0.43,fee STRIPE-6Y16DL2R txn_3PnhiaGtEGgLrOja17XTEj3W Youth Class East 8-14
14/08/2024,0.00,stripe debit STRIPE-CQSIAPBC po_1PmoHsGtEGgLrOjashCGoa7Q
15/08/2024,0.00,stripe debit STRIPE-YEIUUJ8B po_1PnAOkGtEGgLrOja9nWe8lK1
16/08/2024,10.00,sale STRIPE-RZ8NTYIQ txn_3PoYmpGtEGgLrOja1mvEWUjV Outdoor Class East
16/08/2024,-0.35,fee STRIPE-RZ8NTYIQ txn_3PoYmpGtEGgLrOja1mvEWUjV Outdoor Class East
16/08/2024,40.00,sale STRIPE-RZ8NTYIQ txn_3PoYndGtEGgLrOja0MgeB6PR custom
16/08/2024,-0.80,fee STRIPE-RZ8NTYIQ txn_3PoYndGtEGgLrOja0MgeB6PR custom
16/08/2024,0.00,stripe debit STRIPE-Y2UAXHDL po_1PnXFnGtEGgLrOjaLDbL8YSc
17/08/2024,10.00,sale STRIPE-PHWVRKEO txn_3PohewGtEGgLrOja0Qmrm4UK Outdoor Class East
17/08/2024,-0.35,fee STRIPE-PHWVRKEO txn_3PohewGtEGgLrOja0Qmrm4UK Outdoor Class East
17/08/2024,10.00,sale STRIPE-PHWVRKEO txn_3Poi4sGtEGgLrOja1VXQMkBO Outdoor Class East
17/08/2024,-0.35,fee STRIPE-PHWVRKEO txn_3Poi4sGtEGgLrOja1VXQMkBO Outdoor Class East
17/08/2024,15.00,sale STRIPE-PHWVRKEO txn_3PomZDGtEGgLrOja0iO6eLEI Youth Class 10-14
17/08/2024,-0.43,fee STRIPE-PHWVRKEO txn_3PomZDGtEGgLrOja0iO6eLEI Youth Class 10-14
17/08/2024,15.00,sale STRIPE-PHWVRKEO txn_3PomvcGtEGgLrOja0MFryfAq Youth Class 10-14
17/08/2024,-0.43,fee STRIPE-PHWVRKEO txn_3PomvcGtEGgLrOja0MFryfAq Youth Class 10-14
18/08/2024,15.00,sale STRIPE-PHWVRKEO txn_3Pp2SnGtEGgLrOja1p9aBPc8 Youth Class 6-9
18/08/2024,-0.43,fee STRIPE-PHWVRKEO txn_3Pp2SnGtEGgLrOja1p9aBPc8 Youth Class 6-9
19/08/2024,15.00,sale STRIPE-PHWVRKEO txn_3PpSERGtEGgLrOja19mhIbtT Adult Decathlon
19/08/2024,-0.43,fee STRIPE-PHWVRKEO txn_3PpSERGtEGgLrOja19mhIbtT Adult Decathlon
19/08/2024,15.00,sale STRIPE-PHWVRKEO txn_3PpUPqGtEGgLrOja0bUntyUd Adult Decathlon
19/08/2024,-0.43,fee STRIPE-PHWVRKEO txn_3PpUPqGtEGgLrOja0bUntyUd Adult Decathlon
19/08/2024,15.00,sale STRIPE-PHWVRKEO txn_3PpX0BGtEGgLrOja0m3zHM8f Adult Decathlon
19/08/2024,-0.43,fee STRIPE-PHWVRKEO txn_3PpX0BGtEGgLrOja0m3zHM8f Adult Decathlon
19/08/2024,10.00,sale STRIPE-PHWVRKEO txn_3PpYQKGtEGgLrOja025mmsHN Adult Decathlon
19/08/2024,-0.35,fee STRIPE-PHWVRKEO txn_3PpYQKGtEGgLrOja025mmsHN Adult Decathlon
19/08/2024,0.00,stripe debit STRIPE-6Y16DL2R po_1Pny2OGtEGgLrOja6EKHzOUl
20/08/2024,15.00,sale STRIPE-EIFZO0BT txn_3Ppoc5GtEGgLrOja16ozCMu8 Youth Class East 8-14
20/08/2024,-0.43,fee STRIPE-EIFZO0BT txn_3Ppoc5GtEGgLrOja16ozCMu8 Youth Class East 8-14
21/08/2024,10.00,sale STRIPE-VDFPPK2R txn_3Pq23fGtEGgLrOja0tf2S6G8 Outdoor Class East
21/08/2024,-0.53,fee STRIPE-VDFPPK2R txn_3Pq23fGtEGgLrOja0tf2S6G8 Outdoor Class East
21/08/2024,10.00,sale STRIPE-VDFPPK2R txn_3Pq2GAGtEGgLrOja1Y7E0tqp Outdoor Class North
21/08/2024,-0.53,fee STRIPE-VDFPPK2R txn_3Pq2GAGtEGgLrOja1Y7E0tqp Outdoor Class North
21/08/2024,60.00,sale STRIPE-VDFPPK2R txn_3PqDcUGtEGgLrOja0WtzECsp Private Booking
21/08/2024,-1.10,fee STRIPE-VDFPPK2R txn_3PqDcUGtEGgLrOja0WtzECsp Private Booking
21/08/2024,0.00,stripe debit STRIPE-RZ8NTYIQ po_1PpM0UGtEGgLrOjaN9byAVpF
22/08/2024,10.00,sale STRIPE-6W76URVY txn_3PqdK8GtEGgLrOja0jAUE5K6 Outdoor Class East
22/08/2024,-0.35,fee STRIPE-6W76URVY txn_3PqdK8GtEGgLrOja0jAUE5K6 Outdoor Class East
22/08/2024,0.00,stripe debit STRIPE-PHWVRKEO po_1PphWXGtEGgLrOjaqs5d00yb
23/08/2024,0.00,stripe debit STRIPE-EIFZO0BT po_1Pq5niGtEGgLrOjaTKGBGe6u
24/08/2024,40.00,sale STRIPE-E0KNSDKE txn_3Pr6dUGtEGgLrOja0r5qDQ3n custom
24/08/2024,-0.80,fee STRIPE-E0KNSDKE txn_3Pr6dUGtEGgLrOja0r5qDQ3n custom
24/08/2024,10.00,sale STRIPE-E0KNSDKE txn_3Pr6dyGtEGgLrOja0gXyX2fC Outdoor Class East
24/08/2024,-0.35,fee STRIPE-E0KNSDKE txn_3Pr6dyGtEGgLrOja0gXyX2fC Outdoor Class East
24/08/2024,10.00,sale STRIPE-UJOH9OL0 txn_3PrEJFGtEGgLrOja0YUcD4d5 Outdoor Class East
24/08/2024,-0.35,fee STRIPE-UJOH9OL0 txn_3PrEJFGtEGgLrOja0YUcD4d5 Outdoor Class East
24/08/2024,10.00,sale STRIPE-UJOH9OL0 txn_3PrFuvGtEGgLrOja1CFTteVr Outdoor Class East
24/08/2024,-0.35,fee STRIPE-UJOH9OL0 txn_3PrFuvGtEGgLrOja1CFTteVr Outdoor Class East
24/08/2024,280.00,sale STRIPE-UJOH9OL0 txn_3PrIseGtEGgLrOja1R0AcyIC custom
24/08/2024,-4.40,fee STRIPE-UJOH9OL0 txn_3PrIseGtEGgLrOja1R0AcyIC custom
24/08/2024,10.00,sale STRIPE-UJOH9OL0 txn_3PrKVgGtEGgLrOja0BOYrsmc Outdoor Class North
24/08/2024,-0.35,fee STRIPE-UJOH9OL0 txn_3PrKVgGtEGgLrOja0BOYrsmc Outdoor Class North
25/08/2024,10.00,sale STRIPE-UJOH9OL0 txn_3PrbFAGtEGgLrOja0llPHG7w Outdoor Class North
25/08/2024,-0.35,fee STRIPE-UJOH9OL0 txn_3PrbFAGtEGgLrOja0llPHG7w Outdoor Class North
27/08/2024,0.00,stripe debit STRIPE-VDFPPK2R po_1PqR1eGtEGgLrOjaR5oMQLto
28/08/2024,0.00,stripe debit STRIPE-6W76URVY po_1PqmeiGtEGgLrOjaM5Wi4DBC
29/08/2024,0.00,stripe debit STRIPE-E0KNSDKE po_1PsEY9GtEGgLrOja10TBvHcQ
30/08/2024,10.00,sale STRIPE-OXKYI7SF txn_3PtYQeGtEGgLrOja03dwbsm3 Outdoor Class East
30/08/2024,-0.35,fee STRIPE-OXKYI7SF txn_3PtYQeGtEGgLrOja03dwbsm3 Outdoor Class East
30/08/2024,15.00,sale STRIPE-OXKYI7SF txn_3PtYROGtEGgLrOja1DYSUHup Youth Class East 8-14
30/08/2024,-0.43,fee STRIPE-OXKYI7SF txn_3PtYROGtEGgLrOja1DYSUHup Youth Class East 8-14
30/08/2024,0.00,stripe debit STRIPE-UJOH9OL0 po_1PsaokGtEGgLrOja3bp3IidU
31/08/2024,10.00,sale STRIPE-IIQJWJNZ txn_3PtmeOGtEGgLrOja09OXZQhE Outdoor Class East
31/08/2024,-0.35,fee STRIPE-IIQJWJNZ txn_3PtmeOGtEGgLrOja09OXZQhE Outdoor Class East
31/08/2024,10.00,sale STRIPE-IIQJWJNZ txn_3Ptn6TGtEGgLrOja1FxQSCpl Outdoor Class East
31/08/2024,-0.35,fee STRIPE-IIQJWJNZ txn_3Ptn6TGtEGgLrOja1FxQSCpl Outdoor Class East
31/08/2024,10.00,sale STRIPE-IIQJWJNZ txn_3PtnI1GtEGgLrOja0TUyR8gm Outdoor Class East
31/08/2024,-0.35,fee STRIPE-IIQJWJNZ txn_3PtnI1GtEGgLrOja0TUyR8gm Outdoor Class East
31/08/2024,15.00,sale STRIPE-IIQJWJNZ txn_3PttvHGtEGgLrOja105xduqF Youth Class 10-14
31/08/2024,-0.43,fee STRIPE-IIQJWJNZ txn_3PttvHGtEGgLrOja105xduqF Youth Class 10-14
31/08/2024,15.00,sale STRIPE-IIQJWJNZ txn_3PtvYZGtEGgLrOja05TRmGJR Youth Class 6-9
31/08/2024,-0.43,fee STRIPE-IIQJWJNZ txn_3PtvYZGtEGgLrOja05TRmGJR Youth Class 6-9
01/09/2024,15.00,sale STRIPE-IIQJWJNZ txn_3Pu8H8GtEGgLrOja0LaGksnF Youth Class 10-14
01/09/2024,-0.43,fee STRIPE-IIQJWJNZ txn_3Pu8H8GtEGgLrOja0LaGksnF Youth Class 10-14
01/09/2024,15.00,sale STRIPE-IIQJWJNZ txn_3Pu8KWGtEGgLrOja1rYfLs7M Youth Class 10-14
01/09/2024,-0.43,fee STRIPE-IIQJWJNZ txn_3Pu8KWGtEGgLrOja1rYfLs7M Youth Class 10-14
01/09/2024,15.00,sale STRIPE-IIQJWJNZ txn_3Pu8wXGtEGgLrOja1GHLyf5z Youth Class 6-9
01/09/2024,-0.43,fee STRIPE-IIQJWJNZ txn_3Pu8wXGtEGgLrOja1GHLyf5z Youth Class 6-9
01/09/2024,15.00,sale STRIPE-IIQJWJNZ txn_3PuFd0GtEGgLrOja1YGsiUFh Youth Class East 8-14
01/09/2024,-0.43,fee STRIPE-IIQJWJNZ txn_3PuFd0GtEGgLrOja1YGsiUFh Youth Class East 8-14
02/09/2024,30.00,sale STRIPE-IIQJWJNZ txn_3PuZsXGtEGgLrOja1PsZbYXv Adult Decathlon
02/09/2024,-0.65,fee STRIPE-IIQJWJNZ txn_3PuZsXGtEGgLrOja1PsZbYXv Adult Decathlon
02/09/2024,15.00,sale STRIPE-IIQJWJNZ txn_3PuaE9GtEGgLrOja09Oj1kcU Adult Decathlon
02/09/2024,-0.43,fee STRIPE-IIQJWJNZ txn_3PuaE9GtEGgLrOja09Oj1kcU Adult Decathlon
02/09/2024,15.00,sale STRIPE-IIQJWJNZ txn_3PubV5GtEGgLrOja0I7ER6Ud Adult Decathlon
02/09/2024,-0.43,fee STRIPE-IIQJWJNZ txn_3PubV5GtEGgLrOja0I7ER6Ud Adult Decathlon
02/09/2024,15.00,sale STRIPE-IIQJWJNZ txn_3PucCOGtEGgLrOja1uBbEmLc Adult Decathlon
02/09/2024,-0.43,fee STRIPE-IIQJWJNZ txn_3PucCOGtEGgLrOja1uBbEmLc Adult Decathlon
04/09/2024,0.00,stripe debit STRIPE-OXKYI7SF po_1PuR0eGtEGgLrOjaKYI0DfSE
05/09/2024,15.00,sale STRIPE-QJDGQ4K8 txn_3PvgC8GtEGgLrOja0tj2fFrs Youth Class East 8-14
05/09/2024,-0.43,fee STRIPE-QJDGQ4K8 txn_3PvgC8GtEGgLrOja0tj2fFrs Youth Class East 8-14
05/09/2024,0.00,stripe debit STRIPE-IIQJWJNZ po_1PumIGGtEGgLrOjavWMNmyMU
06/09/2024,15.00,sale STRIPE-QZPYVOFL txn_3Pw6wWGtEGgLrOja1f94Hg4M Youth Class East 8-14
06/09/2024,-0.43,fee STRIPE-QZPYVOFL txn_3Pw6wWGtEGgLrOja1f94Hg4M Youth Class East 8-14
06/09/2024,30.00,sale STRIPE-QZPYVOFL txn_3Pw8nHGtEGgLrOja0qSTX4ID Youth Class East 8-14
06/09/2024,-0.65,fee STRIPE-QZPYVOFL txn_3Pw8nHGtEGgLrOja0qSTX4ID Youth Class East 8-14
06/09/2024,10.00,sale STRIPE-QZPYVOFL txn_3Pw9kcGtEGgLrOja0lGXpFqb Outdoor Class East
06/09/2024,-0.35,fee STRIPE-QZPYVOFL txn_3Pw9kcGtEGgLrOja0lGXpFqb Outdoor Class East
07/09/2024,10.00,sale STRIPE-X3NGZT6M txn_3PwImbGtEGgLrOja0bOaWYCx Outdoor Class East
07/09/2024,-0.35,fee STRIPE-X3NGZT6M txn_3PwImbGtEGgLrOja0bOaWYCx Outdoor Class East
07/09/2024,15.00,sale STRIPE-X3NGZT6M txn_3PwIqqGtEGgLrOja0LyNwIAY Youth Decathlon
07/09/2024,-0.43,fee STRIPE-X3NGZT6M txn_3PwIqqGtEGgLrOja0LyNwIAY Youth Decathlon
07/09/2024,10.00,sale STRIPE-X3NGZT6M txn_3PwJW7GtEGgLrOja0EgsckmG Outdoor Class East
07/09/2024,-0.35,fee STRIPE-X3NGZT6M txn_3PwJW7GtEGgLrOja0EgsckmG Outdoor Class East
07/09/2024,10.00,sale STRIPE-X3NGZT6M txn_3PwKX4GtEGgLrOja0sKLtiwW Outdoor Class East
07/09/2024,-0.35,fee STRIPE-X3NGZT6M txn_3PwKX4GtEGgLrOja0sKLtiwW Outdoor Class East
07/09/2024,15.00,sale STRIPE-X3NGZT6M txn_3PwLh9GtEGgLrOja0Cg3nVjc Youth Class East 8-14
07/09/2024,-0.43,fee STRIPE-X3NGZT6M txn_3PwLh9GtEGgLrOja0Cg3nVjc Youth Class East 8-14
07/09/2024,15.00,sale STRIPE-X3NGZT6M txn_3PwLHZGtEGgLrOja12EmUXzm Youth Class 10-14
07/09/2024,-0.43,fee STRIPE-X3NGZT6M txn_3PwLHZGtEGgLrOja12EmUXzm Youth Class 10-14
07/09/2024,15.00,sale STRIPE-X3NGZT6M txn_3PwOoRGtEGgLrOja0xPStUaR Youth Class 10-14
07/09/2024,-0.43,fee STRIPE-X3NGZT6M txn_3PwOoRGtEGgLrOja0xPStUaR Youth Class 10-14
07/09/2024,15.00,sale STRIPE-X3NGZT6M txn_3PwPmIGtEGgLrOja01enIq90 Youth Class 6-9
07/09/2024,-0.43,fee STRIPE-X3NGZT6M txn_3PwPmIGtEGgLrOja01enIq90 Youth Class 6-9
07/09/2024,10.00,sale STRIPE-X3NGZT6M txn_3PwUO3GtEGgLrOja0RfHsBro Outdoor Class North
07/09/2024,-0.35,fee STRIPE-X3NGZT6M txn_3PwUO3GtEGgLrOja0RfHsBro Outdoor Class North
07/09/2024,15.00,sale STRIPE-X3NGZT6M txn_3PwUckGtEGgLrOja1B1DjSQc Youth Class 10-14
07/09/2024,-0.43,fee STRIPE-X3NGZT6M txn_3PwUckGtEGgLrOja1B1DjSQc Youth Class 10-14
07/09/2024,10.00,sale STRIPE-X3NGZT6M txn_3PwWYMGtEGgLrOja0HMe0tzR Outdoor Class North
07/09/2024,-0.35,fee STRIPE-X3NGZT6M txn_3PwWYMGtEGgLrOja0HMe0tzR Outdoor Class North
08/09/2024,15.00,sale STRIPE-X3NGZT6M txn_3PweYQGtEGgLrOja03KOYpp2 Youth Class 6-9
08/09/2024,-0.43,fee STRIPE-X3NGZT6M txn_3PweYQGtEGgLrOja03KOYpp2 Youth Class 6-9
08/09/2024,15.00,sale STRIPE-X3NGZT6M txn_3PweZHGtEGgLrOja06GnL8AS Youth Class 6-9
08/09/2024,-0.43,fee STRIPE-X3NGZT6M txn_3PweZHGtEGgLrOja06GnL8AS Youth Class 6-9
08/09/2024,30.00,sale STRIPE-X3NGZT6M txn_3PweilGtEGgLrOja082hGZBG Youth Class 6-9
08/09/2024,-0.65,fee STRIPE-X3NGZT6M txn_3PweilGtEGgLrOja082hGZBG Youth Class 6-9
08/09/2024,10.00,sale STRIPE-X3NGZT6M txn_3PwelFGtEGgLrOja1GsdIttb Outdoor Class North
08/09/2024,-0.35,fee STRIPE-X3NGZT6M txn_3PwelFGtEGgLrOja1GsdIttb Outdoor Class North
08/09/2024,15.00,sale STRIPE-X3NGZT6M txn_3Pwg4xGtEGgLrOja1gusigXj Youth Class 6-9
08/09/2024,-0.43,fee STRIPE-X3NGZT6M txn_3Pwg4xGtEGgLrOja1gusigXj Youth Class 6-9
08/09/2024,15.00,sale STRIPE-X3NGZT6M txn_3PwgUpGtEGgLrOja0fev5ahI Youth Class 10-14
08/09/2024,-0.43,fee STRIPE-X3NGZT6M txn_3PwgUpGtEGgLrOja0fev5ahI Youth Class 10-14
08/09/2024,10.00,sale STRIPE-X3NGZT6M txn_3PwhHgGtEGgLrOja0LyLfFgb Outdoor Class North
08/09/2024,-0.35,fee STRIPE-X3NGZT6M txn_3PwhHgGtEGgLrOja0LyLfFgb Outdoor Class North
08/09/2024,10.00,sale STRIPE-X3NGZT6M txn_3PwhtUGtEGgLrOja0BobmfPn Outdoor Class North
08/09/2024,-0.32,fee STRIPE-X3NGZT6M txn_3PwhtUGtEGgLrOja0BobmfPn Outdoor Class North
08/09/2024,15.00,sale STRIPE-X3NGZT6M txn_3PwswSGtEGgLrOja0yWH6Tzn Youth Decathlon
08/09/2024,-0.43,fee STRIPE-X3NGZT6M txn_3PwswSGtEGgLrOja0yWH6Tzn Youth Decathlon
09/09/2024,15.00,sale STRIPE-X3NGZT6M txn_3Px4SxGtEGgLrOja16qTzswR Adult Decathlon
09/09/2024,-0.38,fee STRIPE-X3NGZT6M txn_3Px4SxGtEGgLrOja16qTzswR Adult Decathlon
09/09/2024,15.00,sale STRIPE-X3NGZT6M txn_3Px9nwGtEGgLrOja02IETTHd Adult Decathlon
09/09/2024,-0.43,fee STRIPE-X3NGZT6M txn_3Px9nwGtEGgLrOja02IETTHd Adult Decathlon
09/09/2024,10.00,sale STRIPE-X3NGZT6M txn_3PxAawGtEGgLrOja0kOkQPJb Adult Decathlon
09/09/2024,-0.35,fee STRIPE-X3NGZT6M txn_3PxAawGtEGgLrOja0kOkQPJb Adult Decathlon
10/09/2024,0.00,stripe debit STRIPE-QJDGQ4K8 po_1PvsCPGtEGgLrOjaRUSpfdBl
11/09/2024,60.00,sale STRIPE-5USDR3ET txn_3PxmOYGtEGgLrOja1ZVKMdsF Private Booking
11/09/2024,-1.10,fee STRIPE-5USDR3ET txn_3PxmOYGtEGgLrOja1ZVKMdsF Private Booking
11/09/2024,0.00,stripe debit STRIPE-QZPYVOFL po_1Pwy6nGtEGgLrOjaFvTLg8zC
12/09/2024,15.00,sale STRIPE-IFCXXKWD txn_3PyCNoGtEGgLrOja1d9wMDwd Youth Decathlon
12/09/2024,-0.43,fee STRIPE-IFCXXKWD txn_3PyCNoGtEGgLrOja1d9wMDwd Youth Decathlon
12/09/2024,10.00,sale STRIPE-IFCXXKWD txn_3PyImOGtEGgLrOja1JQpn3Z2 Outdoor Class East
12/09/2024,-0.35,fee STRIPE-IFCXXKWD txn_3PyImOGtEGgLrOja1JQpn3Z2 Outdoor Class East
12/09/2024,15.00,sale STRIPE-IFCXXKWD txn_3PyJH9GtEGgLrOja0wDwhxLU Youth Class East 8-14
12/09/2024,-0.43,fee STRIPE-IFCXXKWD txn_3PyJH9GtEGgLrOja0wDwhxLU Youth Class East 8-14
12/09/2024,10.00,sale STRIPE-IFCXXKWD txn_3PyJHxGtEGgLrOja03RtKbZq Outdoor Class East
12/09/2024,-0.35,fee STRIPE-IFCXXKWD txn_3PyJHxGtEGgLrOja03RtKbZq Outdoor Class East
12/09/2024,0.00,stripe debit STRIPE-X3NGZT6M po_1PxJtxGtEGgLrOjaVVSLzKWN
13/09/2024,15.00,sale STRIPE-GXS3PUNV txn_3PyWTCGtEGgLrOja0a1fYig8 Youth Class East 8-14
13/09/2024,-0.43,fee STRIPE-GXS3PUNV txn_3PyWTCGtEGgLrOja0a1fYig8 Youth Class East 8-14
13/09/2024,30.00,sale STRIPE-GXS3PUNV txn_3PyWZNGtEGgLrOja1toEQzjA Youth Class East 8-14
13/09/2024,-0.65,fee STRIPE-GXS3PUNV txn_3PyWZNGtEGgLrOja1toEQzjA Youth Class East 8-14
13/09/2024,15.00,sale STRIPE-GXS3PUNV txn_3PyWcdGtEGgLrOja1iINVUcA Youth Class East 8-14
13/09/2024,-0.43,fee STRIPE-GXS3PUNV txn_3PyWcdGtEGgLrOja1iINVUcA Youth Class East 8-14
13/09/2024,30.00,sale STRIPE-GXS3PUNV txn_3PyepZGtEGgLrOja0Bs7yIVG Youth Class East 8-14
13/09/2024,-0.65,fee STRIPE-GXS3PUNV txn_3PyepZGtEGgLrOja0Bs7yIVG Youth Class East 8-14
13/09/2024,15.00,sale STRIPE-GXS3PUNV txn_3PyfEOGtEGgLrOja06ZpqRg3 Youth Class East 8-14
13/09/2024,-0.43,fee STRIPE-GXS3PUNV txn_3PyfEOGtEGgLrOja06ZpqRg3 Youth Class East 8-14
13/09/2024,15.00,sale STRIPE-GXS3PUNV txn_3PygsTGtEGgLrOja0iMayEa8 Youth Class East 8-14
13/09/2024,-0.43,fee STRIPE-GXS3PUNV txn_3PygsTGtEGgLrOja0iMayEa8 Youth Class East 8-14
14/09/2024,10.00,sale STRIPE-GXOCGTAT txn_3PyqDLGtEGgLrOja1qqJ4Yz8 Outdoor Class East
14/09/2024,-0.35,fee STRIPE-GXOCGTAT txn_3PyqDLGtEGgLrOja1qqJ4Yz8 Outdoor Class East
14/09/2024,40.00,sale STRIPE-GXOCGTAT txn_3PyqKwGtEGgLrOja1c0kpwgR custom
14/09/2024,-0.80,fee STRIPE-GXOCGTAT txn_3PyqKwGtEGgLrOja1c0kpwgR custom
14/09/2024,10.00,sale STRIPE-GXOCGTAT txn_3PyqLZGtEGgLrOja05c7CrVz Outdoor Class East
14/09/2024,-0.35,fee STRIPE-GXOCGTAT txn_3PyqLZGtEGgLrOja05c7CrVz Outdoor Class East
14/09/2024,10.00,sale STRIPE-GXOCGTAT txn_3PyqoNGtEGgLrOja0vg1d6Rv Outdoor Class East
14/09/2024,-0.35,fee STRIPE-GXOCGTAT txn_3PyqoNGtEGgLrOja0vg1d6Rv Outdoor Class East
14/09/2024,10.00,sale STRIPE-GXOCGTAT txn_3PyrmrGtEGgLrOja0DvbYAj6 Outdoor Class East
14/09/2024,-0.35,fee STRIPE-GXOCGTAT txn_3PyrmrGtEGgLrOja0DvbYAj6 Outdoor Class East
14/09/2024,15.00,sale STRIPE-GXOCGTAT txn_3PyxtcGtEGgLrOja0WMWF5Nk Youth Class 6-9
14/09/2024,-0.43,fee STRIPE-GXOCGTAT txn_3PyxtcGtEGgLrOja0WMWF5Nk Youth Class 6-9
14/09/2024,15.00,sale STRIPE-GXOCGTAT txn_3Pz12sGtEGgLrOja1aa6pjzP Youth Class 6-9
14/09/2024,-0.43,fee STRIPE-GXOCGTAT txn_3Pz12sGtEGgLrOja1aa6pjzP Youth Class 6-9
14/09/2024,15.00,sale STRIPE-GXOCGTAT txn_3Pz2gVGtEGgLrOja0nqqQx4O Youth Class 6-9
14/09/2024,-0.43,fee STRIPE-GXOCGTAT txn_3Pz2gVGtEGgLrOja0nqqQx4O Youth Class 6-9
15/09/2024,15.00,sale STRIPE-GXOCGTAT txn_3PzE06GtEGgLrOja1j4Ul1rK Youth Class 10-14
15/09/2024,-0.43,fee STRIPE-GXOCGTAT txn_3PzE06GtEGgLrOja1j4Ul1rK Youth Class 10-14
15/09/2024,15.00,sale STRIPE-GXOCGTAT txn_3PzNNpGtEGgLrOja1iXf0F0g Youth Decathlon
15/09/2024,-0.43,fee STRIPE-GXOCGTAT txn_3PzNNpGtEGgLrOja1iXf0F0g Youth Decathlon
15/09/2024,15.00,sale STRIPE-GXOCGTAT txn_3PzOE6GtEGgLrOja0BvjoVSl Youth Decathlon
15/09/2024,-0.43,fee STRIPE-GXOCGTAT txn_3PzOE6GtEGgLrOja0BvjoVSl Youth Decathlon
16/09/2024,15.00,sale STRIPE-GXOCGTAT txn_3PzfEqGtEGgLrOja0pskF3Ez Adult Decathlon
16/09/2024,-0.43,fee STRIPE-GXOCGTAT txn_3PzfEqGtEGgLrOja0pskF3Ez Adult Decathlon
16/09/2024,10.00,sale STRIPE-GXOCGTAT txn_3Pzhp5GtEGgLrOja1sDVkvhw Adult Decathlon
16/09/2024,-0.35,fee STRIPE-GXOCGTAT txn_3Pzhp5GtEGgLrOja1sDVkvhw Adult Decathlon
16/09/2024,0.00,stripe debit STRIPE-5USDR3ET po_1Py3dyGtEGgLrOjakJbdgPgz
17/09/2024,0.00,stripe debit STRIPE-IFCXXKWD po_1PyOckGtEGgLrOjacsQZ3dpG
18/09/2024,60.00,sale STRIPE-1VX3LWKX txn_3Q0L8HGtEGgLrOja0BODDFNa Private Booking
18/09/2024,-1.10,fee STRIPE-1VX3LWKX txn_3Q0L8HGtEGgLrOja0BODDFNa Private Booking
18/09/2024,0.00,stripe debit STRIPE-GXS3PUNV po_1PzUEYGtEGgLrOjawv89qCLP
19/09/2024,0.00,stripe debit STRIPE-GXOCGTAT po_1Pzqb5GtEGgLrOjaAMitPkGB
20/09/2024,10.00,sale STRIPE-K3TOSWOE txn_3Q1C32GtEGgLrOja0CCtX29s Outdoor Class East
20/09/2024,-0.32,fee STRIPE-K3TOSWOE txn_3Q1C32GtEGgLrOja0CCtX29s Outdoor Class East
21/09/2024,10.00,sale STRIPE-K3TOSWOE txn_3Q1FuDGtEGgLrOja0aZ4NeDG Outdoor Class East
21/09/2024,-0.35,fee STRIPE-K3TOSWOE txn_3Q1FuDGtEGgLrOja0aZ4NeDG Outdoor Class East
21/09/2024,40.00,sale STRIPE-K3TOSWOE txn_3Q1FumGtEGgLrOja0O0N719r custom
21/09/2024,-0.80,fee STRIPE-K3TOSWOE txn_3Q1FumGtEGgLrOja0O0N719r custom
21/09/2024,10.00,sale STRIPE-AQMCR7W8 txn_3Q1NVQGtEGgLrOja14DJ95tA Outdoor Class East
21/09/2024,-0.35,fee STRIPE-AQMCR7W8 txn_3Q1NVQGtEGgLrOja14DJ95tA Outdoor Class East
21/09/2024,10.00,sale STRIPE-AQMCR7W8 txn_3Q1NnxGtEGgLrOja0JT2Dsx8 Outdoor Class East
21/09/2024,-0.35,fee STRIPE-AQMCR7W8 txn_3Q1NnxGtEGgLrOja0JT2Dsx8 Outdoor Class East
21/09/2024,10.00,sale STRIPE-AQMCR7W8 txn_3Q1PdsGtEGgLrOja0OwcS89f Outdoor Class East
21/09/2024,-0.35,fee STRIPE-AQMCR7W8 txn_3Q1PdsGtEGgLrOja0OwcS89f Outdoor Class East
21/09/2024,15.00,sale STRIPE-AQMCR7W8 txn_3Q1SaGGtEGgLrOja1pgnJBdl Youth Class 10-14
21/09/2024,-0.43,fee STRIPE-AQMCR7W8 txn_3Q1SaGGtEGgLrOja1pgnJBdl Youth Class 10-14
21/09/2024,15.00,sale STRIPE-AQMCR7W8 txn_3Q1WHcGtEGgLrOja14tNG0oP Youth Class 10-14
21/09/2024,-0.43,fee STRIPE-AQMCR7W8 txn_3Q1WHcGtEGgLrOja14tNG0oP Youth Class 10-14
21/09/2024,30.00,sale STRIPE-AQMCR7W8 txn_3Q1XsqGtEGgLrOja0STuZc86 Youth Class 6-9
21/09/2024,-0.65,fee STRIPE-AQMCR7W8 txn_3Q1XsqGtEGgLrOja0STuZc86 Youth Class 6-9
21/09/2024,10.00,sale STRIPE-AQMCR7W8 txn_3Q1ZufGtEGgLrOja0pDu0xqk Outdoor Class North
21/09/2024,-0.35,fee STRIPE-AQMCR7W8 txn_3Q1ZufGtEGgLrOja0pDu0xqk Outdoor Class North
21/09/2024,15.00,sale STRIPE-AQMCR7W8 txn_3Q1aInGtEGgLrOja1yHEURtA Youth Class 10-14
21/09/2024,-0.43,fee STRIPE-AQMCR7W8 txn_3Q1aInGtEGgLrOja1yHEURtA Youth Class 10-14
21/09/2024,15.00,sale STRIPE-AQMCR7W8 txn_3Q1abXGtEGgLrOja1sR8eAuv Youth Class 6-9
21/09/2024,-0.43,fee STRIPE-AQMCR7W8 txn_3Q1abXGtEGgLrOja1sR8eAuv Youth Class 6-9
22/09/2024,10.00,sale STRIPE-AQMCR7W8 txn_3Q1dAHGtEGgLrOja1eYY4ESf Outdoor Class North
22/09/2024,-0.35,fee STRIPE-AQMCR7W8 txn_3Q1dAHGtEGgLrOja1eYY4ESf Outdoor Class North
22/09/2024,15.00,sale STRIPE-AQMCR7W8 txn_3Q1jcSGtEGgLrOja1lJtYtT1 Youth Class 10-14
22/09/2024,-0.43,fee STRIPE-AQMCR7W8 txn_3Q1jcSGtEGgLrOja1lJtYtT1 Youth Class 10-14
22/09/2024,15.00,sale STRIPE-AQMCR7W8 txn_3Q1kZjGtEGgLrOja1iFYyVgW Youth Class 10-14
22/09/2024,-0.43,fee STRIPE-AQMCR7W8 txn_3Q1kZjGtEGgLrOja1iFYyVgW Youth Class 10-14
22/09/2024,30.00,sale STRIPE-AQMCR7W8 txn_3Q1kj1GtEGgLrOja03vnnD1o Youth Class 6-9
22/09/2024,-0.65,fee STRIPE-AQMCR7W8 txn_3Q1kj1GtEGgLrOja03vnnD1o Youth Class 6-9
23/09/2024,15.00,sale STRIPE-AQMCR7W8 txn_3Q28HwGtEGgLrOja0v8xKdtB Youth Decathlon
23/09/2024,-0.43,fee STRIPE-AQMCR7W8 txn_3Q28HwGtEGgLrOja0v8xKdtB Youth Decathlon
23/09/2024,30.00,sale STRIPE-AQMCR7W8 txn_3Q2A6ZGtEGgLrOja0sq1NPhL Youth Class 6-9
23/09/2024,-0.65,fee STRIPE-AQMCR7W8 txn_3Q2A6ZGtEGgLrOja0sq1NPhL Youth Class 6-9
23/09/2024,15.00,sale STRIPE-AQMCR7W8 txn_3Q2C2mGtEGgLrOja1srHC7yl Adult Decathlon
23/09/2024,-0.43,fee STRIPE-AQMCR7W8 txn_3Q2C2mGtEGgLrOja1srHC7yl Adult Decathlon
23/09/2024,15.00,sale STRIPE-AQMCR7W8 txn_3Q2C8uGtEGgLrOja17O0yUTK Adult Decathlon
23/09/2024,-0.43,fee STRIPE-AQMCR7W8 txn_3Q2C8uGtEGgLrOja17O0yUTK Adult Decathlon
23/09/2024,15.00,sale STRIPE-AQMCR7W8 txn_3Q2Eg4GtEGgLrOja0up0rVNG Adult Decathlon
23/09/2024,-0.43,fee STRIPE-AQMCR7W8 txn_3Q2Eg4GtEGgLrOja0up0rVNG Adult Decathlon
23/09/2024,10.00,sale STRIPE-AQMCR7W8 txn_3Q2FkhGtEGgLrOja0jzz9uNl Adult Decathlon
23/09/2024,-0.35,fee STRIPE-AQMCR7W8 txn_3Q2FkhGtEGgLrOja0jzz9uNl Adult Decathlon
23/09/2024,0.00,stripe debit STRIPE-1VX3LWKX po_1Q0cBfGtEGgLrOjaKCvTtFfo
25/09/2024,350.00,sale STRIPE-0JHA2KBV txn_3Q2rxRGtEGgLrOja0CN5X1m4 custom
25/09/2024,-6.85,fee STRIPE-0JHA2KBV txn_3Q2rxRGtEGgLrOja0CN5X1m4 custom
25/09/2024,60.00,sale STRIPE-0JHA2KBV txn_3Q2uYcGtEGgLrOja0fArREyJ Private Booking
25/09/2024,-1.10,fee STRIPE-0JHA2KBV txn_3Q2uYcGtEGgLrOja0fArREyJ Private Booking
25/09/2024,0.00,stripe debit STRIPE-K3TOSWOE po_1Q222fGtEGgLrOjaX7y45Wnu
26/09/2024,10.00,sale STRIPE-JN54ZSCM txn_3Q3KpEGtEGgLrOja1BMWaQ3n Outdoor Class East
26/09/2024,-0.35,fee STRIPE-JN54ZSCM txn_3Q3KpEGtEGgLrOja1BMWaQ3n Outdoor Class East
26/09/2024,0.00,stripe debit STRIPE-AQMCR7W8 po_1Q2NyrGtEGgLrOja67COY59F
27/09/2024,10.00,sale STRIPE-PHZTIQAI txn_3Q3ijuGtEGgLrOja0tSpCy2p Outdoor Class East
27/09/2024,-0.32,fee STRIPE-PHZTIQAI txn_3Q3ijuGtEGgLrOja0tSpCy2p Outdoor Class East
28/09/2024,10.00,sale STRIPE-YXB9FFKM txn_3Q3uPMGtEGgLrOja0DXxmlnn Outdoor Class East
28/09/2024,-0.35,fee STRIPE-YXB9FFKM txn_3Q3uPMGtEGgLrOja0DXxmlnn Outdoor Class East
28/09/2024,10.00,sale STRIPE-YXB9FFKM txn_3Q3vbIGtEGgLrOja0PWDUjNz Outdoor Class East
