01/05/2024,15.00,sale STRIPE-CIQBV0NKIHUC2ZXW9PRXXY0PPETC txn_3PBjvdGtEGgLrOja1VVHb4x0 Youth Class 10-14
01/05/2024,-0.43,fee STRIPE-CIQBV0NKIHUC2ZXW9PRXXY0PPETC txn_3PBjvdGtEGgLrOja1VVHb4x0 Youth Class 10-14
01/05/2024,0.00,stripe debit STRIPE-H83QAOMN99KHTPE2NZVF9WOME5XQ po_1PAjqnGtEGgLrOjaqDIXCjBJ
02/05/2024,0.00,stripe debit STRIPE-FJ3UUCQWFV9JK1KMECNGPYT8AV3G po_1PB69AGtEGgLrOjaKsEbnXgP
03/05/2024,30.00,sale STRIPE-L8XTVMIPIYQ0ITDSH58QU3ATXSNT txn_3PCHV6GtEGgLrOja0KUYUyDN Youth Class 6-9
03/05/2024,-0.65,fee STRIPE-L8XTVMIPIYQ0ITDSH58QU3ATXSNT txn_3PCHV6GtEGgLrOja0KUYUyDN Youth Class 6-9
03/05/2024,10.00,sale STRIPE-L8XTVMIPIYQ0ITDSH58QU3ATXSNT txn_3PCLEoGtEGgLrOja03CzZDAj Outdoor Class East
03/05/2024,-0.35,fee STRIPE-L8XTVMIPIYQ0ITDSH58QU3ATXSNT txn_3PCLEoGtEGgLrOja03CzZDAj Outdoor Class East
03/05/2024,20.00,sale STRIPE-L8XTVMIPIYQ0ITDSH58QU3ATXSNT txn_3PCRCkGtEGgLrOja0owAhe9Q Outdoor Class East
03/05/2024,-0.50,fee STRIPE-L8XTVMIPIYQ0ITDSH58QU3ATXSNT txn_3PCRCkGtEGgLrOja0owAhe9Q Outdoor Class East
04/05/2024,10.00,sale STRIPE-L8XTVMIPIYQ0ITDSH58QU3ATXSNT txn_3PCVt3GtEGgLrOja039nQ1cv Outdoor Class East
04/05/2024,-0.35,fee STRIPE-L8XTVMIPIYQ0ITDSH58QU3ATXSNT txn_3PCVt3GtEGgLrOja039nQ1cv Outdoor Class East
04/05/2024,10.00,sale STRIPE-MUYHJLD8VML5BJW2DYWZSXM3MXYE txn_3PCcAUGtEGgLrOja0J5HoEEY Outdoor Class East
04/05/2024,-0.53,fee STRIPE-MUYHJLD8VML5BJW2DYWZSXM3MXYE txn_3PCcAUGtEGgLrOja0J5HoEEY Outdoor Class East
04/05/2024,20.00,sale STRIPE-MUYHJLD8VML5BJW2DYWZSXM3MXYE txn_3PCd5ZGtEGgLrOja087DuDXh Outdoor Class East
04/05/2024,-0.50,fee STRIPE-MUYHJLD8VML5BJW2DYWZSXM3MXYE txn_3PCd5ZGtEGgLrOja087DuDXh Outdoor Class East
04/05/2024,10.00,sale STRIPE-MUYHJLD8VML5BJW2DYWZSXM3MXYE txn_3PCdWKGtEGgLrOja0UMkP8QV Outdoor Class East
04/05/2024,-0.35,fee STRIPE-MUYHJLD8VML5BJW2DYWZSXM3MXYE txn_3PCdWKGtEGgLrOja0UMkP8QV Outdoor Class East
04/05/2024,10.00,sale STRIPE-MUYHJLD8VML5BJW2DYWZSXM3MXYE txn_3PCdpmGtEGgLrOja04dFjSri Outdoor Class East
04/05/2024,-0.35,fee STRIPE-MUYHJLD8VML5BJW2DYWZSXM3MXYE txn_3PCdpmGtEGgLrOja04dFjSri Outdoor Class East
04/05/2024,15.00,sale STRIPE-MUYHJLD8VML5BJW2DYWZSXM3MXYE txn_3PCeUCGtEGgLrOja0OGIMEn0 Youth Class 10-14
04/05/2024,-0.43,fee STRIPE-MUYHJLD8VML5BJW2DYWZSXM3MXYE txn_3PCeUCGtEGgLrOja0OGIMEn0 Youth Class 10-14
04/05/2024,15.00,sale STRIPE-MUYHJLD8VML5BJW2DYWZSXM3MXYE txn_3PCgV8GtEGgLrOja1URYZUIL Youth Class 6-9
04/05/2024,-0.38,fee STRIPE-MUYHJLD8VML5BJW2DYWZSXM3MXYE txn_3PCgV8GtEGgLrOja1URYZUIL Youth Class 6-9
04/05/2024,15.00,sale STRIPE-MUYHJLD8VML5BJW2DYWZSXM3MXYE txn_3PCibaGtEGgLrOja0HkrTOf9 Youth Class 10-14
04/05/2024,-0.43,fee STRIPE-MUYHJLD8VML5BJW2DYWZSXM3MXYE txn_3PCibaGtEGgLrOja0HkrTOf9 Youth Class 10-14
04/05/2024,10.00,sale STRIPE-MUYHJLD8VML5BJW2DYWZSXM3MXYE txn_3PClrEGtEGgLrOja1cwzaoBZ Outdoor Class North
04/05/2024,-0.35,fee STRIPE-MUYHJLD8VML5BJW2DYWZSXM3MXYE txn_3PClrEGtEGgLrOja1cwzaoBZ Outdoor Class North
04/05/2024,30.00,sale STRIPE-MUYHJLD8VML5BJW2DYWZSXM3MXYE txn_3PCm9iGtEGgLrOja1VyQqtia Youth Class 10-14
04/05/2024,-0.65,fee STRIPE-MUYHJLD8VML5BJW2DYWZSXM3MXYE txn_3PCm9iGtEGgLrOja1VyQqtia Youth Class 10-14
04/05/2024,30.00,sale STRIPE-MUYHJLD8VML5BJW2DYWZSXM3MXYE txn_3PCnpJGtEGgLrOja1JYekhMO Youth Class 6-9
04/05/2024,-0.65,fee STRIPE-MUYHJLD8VML5BJW2DYWZSXM3MXYE txn_3PCnpJGtEGgLrOja1JYekhMO Youth Class 6-9
04/05/2024,10.00,sale STRIPE-MUYHJLD8VML5BJW2DYWZSXM3MXYE txn_3PCpJWGtEGgLrOja1ENov6HE Outdoor Class North
04/05/2024,-0.35,fee STRIPE-MUYHJLD8VML5BJW2DYWZSXM3MXYE txn_3PCpJWGtEGgLrOja1ENov6HE Outdoor Class North
04/05/2024,10.00,sale STRIPE-MUYHJLD8VML5BJW2DYWZSXM3MXYE txn_3PCpT0GtEGgLrOja0Cxvxy9l Outdoor Class North
04/05/2024,-0.35,fee STRIPE-MUYHJLD8VML5BJW2DYWZSXM3MXYE txn_3PCpT0GtEGgLrOja0Cxvxy9l Outdoor Class North
04/05/2024,15.00,sale STRIPE-MUYHJLD8VML5BJW2DYWZSXM3MXYE txn_3PCr6CGtEGgLrOja03qcWd6m Youth Class 6-9
04/05/2024,-0.43,fee STRIPE-MUYHJLD8VML5BJW2DYWZSXM3MXYE txn_3PCr6CGtEGgLrOja03qcWd6m Youth Class 6-9
05/05/2024,15.00,sale STRIPE-MUYHJLD8VML5BJW2DYWZSXM3MXYE txn_3PCskfGtEGgLrOja1O6845Bc Youth Class 6-9
05/05/2024,-0.43,fee STRIPE-MUYHJLD8VML5BJW2DYWZSXM3MXYE txn_3PCskfGtEGgLrOja1O6845Bc Youth Class 6-9
05/05/2024,15.00,sale STRIPE-MUYHJLD8VML5BJW2DYWZSXM3MXYE txn_3PCyfVGtEGgLrOja1G6Je5Vb Youth Class 6-9
05/05/2024,-0.43,fee STRIPE-MUYHJLD8VML5BJW2DYWZSXM3MXYE txn_3PCyfVGtEGgLrOja1G6Je5Vb Youth Class 6-9
05/05/2024,15.00,sale STRIPE-MUYHJLD8VML5BJW2DYWZSXM3MXYE txn_3PD04AGtEGgLrOja0uMuG93v Youth Class 10-14
05/05/2024,-0.43,fee STRIPE-MUYHJLD8VML5BJW2DYWZSXM3MXYE txn_3PD04AGtEGgLrOja0uMuG93v Youth Class 10-14
05/05/2024,10.00,sale STRIPE-MUYHJLD8VML5BJW2DYWZSXM3MXYE txn_3PD0lEGtEGgLrOja0sKQPMgF Outdoor Class North
05/05/2024,-0.35,fee STRIPE-MUYHJLD8VML5BJW2DYWZSXM3MXYE txn_3PD0lEGtEGgLrOja0sKQPMgF Outdoor Class North
05/05/2024,30.00,sale STRIPE-MUYHJLD8VML5BJW2DYWZSXM3MXYE txn_3PD1lAGtEGgLrOja0f8s61nB Youth Class 6-9
05/05/2024,-0.65,fee STRIPE-MUYHJLD8VML5BJW2DYWZSXM3MXYE txn_3PD1lAGtEGgLrOja0f8s61nB Youth Class 6-9
06/05/2024,15.00,sale STRIPE-MUYHJLD8VML5BJW2DYWZSXM3MXYE txn_3PDRDGGtEGgLrOja07LaWpBG Adult Decathlon
06/05/2024,-0.43,fee STRIPE-MUYHJLD8VML5BJW2DYWZSXM3MXYE txn_3PDRDGGtEGgLrOja07LaWpBG Adult Decathlon
06/05/2024,15.00,refund STRIPE-MUYHJLD8VML5BJW2DYWZSXM3MXYE txn_3PDRDGGtEGgLrOja0Ixeatt7 Adult Decathlon
07/05/2024,15.00,sale STRIPE-MUYHJLD8VML5BJW2DYWZSXM3MXYE txn_3PDmEqGtEGgLrOja0hABRWMR Youth Decathlon
07/05/2024,-0.43,fee STRIPE-MUYHJLD8VML5BJW2DYWZSXM3MXYE txn_3PDmEqGtEGgLrOja0hABRWMR Youth Decathlon
07/05/2024,10.00,sale STRIPE-MUYHJLD8VML5BJW2DYWZSXM3MXYE txn_3PDpnoGtEGgLrOja1WkUtM5v Outdoor Class East
07/05/2024,-0.53,fee STRIPE-MUYHJLD8VML5BJW2DYWZSXM3MXYE txn_3PDpnoGtEGgLrOja1WkUtM5v Outdoor Class East
07/05/2024,0.00,stripe debit STRIPE-CIQBV0NKIHUC2ZXW9PRXXY0PPETC po_1PBrmJGtEGgLrOjaqZqU8Phj
08/05/2024,60.00,sale STRIPE-G0DSRXNAGFW3LLA4VHEFMSRED9BI txn_3PE7dpGtEGgLrOja0FhQIf9l Private Booking
08/05/2024,-1.10,fee STRIPE-G0DSRXNAGFW3LLA4VHEFMSRED9BI txn_3PE7dpGtEGgLrOja0FhQIf9l Private Booking
08/05/2024,30.00,sale STRIPE-G0DSRXNAGFW3LLA4VHEFMSRED9BI txn_3PE8NxGtEGgLrOja0j3cC5Id Youth Class 6-9
08/05/2024,-0.65,fee STRIPE-G0DSRXNAGFW3LLA4VHEFMSRED9BI txn_3PE8NxGtEGgLrOja0j3cC5Id Youth Class 6-9
08/05/2024,15.00,sale STRIPE-G0DSRXNAGFW3LLA4VHEFMSRED9BI txn_3PEEyOGtEGgLrOja0poochWN Youth Class 10-14
08/05/2024,-0.43,fee STRIPE-G0DSRXNAGFW3LLA4VHEFMSRED9BI txn_3PEEyOGtEGgLrOja0poochWN Youth Class 10-14
09/05/2024,0.00,stripe debit STRIPE-L8XTVMIPIYQ0ITDSH58QU3ATXSNT po_1PDdJwGtEGgLrOjaWVnwvXAP
10/05/2024,15.00,sale STRIPE-CX2FFHGK txn_3PEnsqGtEGgLrOja1sgAkD2d Adult Decathlon
10/05/2024,-0.43,fee STRIPE-CX2FFHGK txn_3PEnsqGtEGgLrOja1sgAkD2d Adult Decathlon
10/05/2024,15.00,sale STRIPE-CX2FFHGK txn_3PEnutGtEGgLrOja0o1pGiFs Youth Decathlon
10/05/2024,-0.43,fee STRIPE-CX2FFHGK txn_3PEnutGtEGgLrOja0o1pGiFs Youth Decathlon
10/05/2024,10.00,sale STRIPE-CX2FFHGK txn_3PEzWIGtEGgLrOja00I2lCrd Outdoor Class East
10/05/2024,-0.35,fee STRIPE-CX2FFHGK txn_3PEzWIGtEGgLrOja00I2lCrd Outdoor Class East
10/05/2024,40.00,sale STRIPE-CX2FFHGK txn_3PEzWtGtEGgLrOja0zCVrscZ custom
10/05/2024,-0.80,fee STRIPE-CX2FFHGK txn_3PEzWtGtEGgLrOja0zCVrscZ custom
10/05/2024,0.00,stripe debit STRIPE-MUYHJLD8VML5BJW2DYWZSXM3MXYE po_1PDzcLGtEGgLrOjasYAEG0t2
11/05/2024,10.00,sale STRIPE-W7HYZ7HD txn_3PFAdWGtEGgLrOja0B2QfiZC Outdoor Class East
11/05/2024,-0.35,fee STRIPE-W7HYZ7HD txn_3PFAdWGtEGgLrOja0B2QfiZC Outdoor Class East
11/05/2024,15.00,sale STRIPE-W7HYZ7HD txn_3PFFsKGtEGgLrOja1ZCOKOME Youth Class 10-14
11/05/2024,-0.43,fee STRIPE-W7HYZ7HD txn_3PFFsKGtEGgLrOja1ZCOKOME Youth Class 10-14
11/05/2024,15.00,sale STRIPE-W7HYZ7HD txn_3PFH0nGtEGgLrOja0BtTgW8T Youth Class 10-14
11/05/2024,-0.43,fee STRIPE-W7HYZ7HD txn_3PFH0nGtEGgLrOja0BtTgW8T Youth Class 10-14
11/05/2024,15.00,sale STRIPE-W7HYZ7HD txn_3PFHpnGtEGgLrOja1M32zo9y Youth Class 6-9
11/05/2024,-0.43,fee STRIPE-W7HYZ7HD txn_3PFHpnGtEGgLrOja1M32zo9y Youth Class 6-9
11/05/2024,15.00,sale STRIPE-W7HYZ7HD txn_3PFKDtGtEGgLrOja0JUdtHci Youth Class 10-14
11/05/2024,-0.43,fee STRIPE-W7HYZ7HD txn_3PFKDtGtEGgLrOja0JUdtHci Youth Class 10-14
11/05/2024,15.00,sale STRIPE-W7HYZ7HD txn_3PFLBwGtEGgLrOja0bYVeJbs Youth Class 6-9
11/05/2024,-0.43,fee STRIPE-W7HYZ7HD txn_3PFLBwGtEGgLrOja0bYVeJbs Youth Class 6-9
11/05/2024,15.00,sale STRIPE-W7HYZ7HD txn_3PFNP9GtEGgLrOja04OWcHP1 Youth Class 10-14
11/05/2024,-0.43,fee STRIPE-W7HYZ7HD txn_3PFNP9GtEGgLrOja04OWcHP1 Youth Class 10-14
11/05/2024,15.00,sale STRIPE-W7HYZ7HD txn_3PFNQZGtEGgLrOja1Z0IZTRs Youth Class 6-9
11/05/2024,-0.43,fee STRIPE-W7HYZ7HD txn_3PFNQZGtEGgLrOja1Z0IZTRs Youth Class 6-9
11/05/2024,10.00,sale STRIPE-W7HYZ7HD txn_3PFNevGtEGgLrOja0JIseutz Outdoor Class North
11/05/2024,-0.35,fee STRIPE-W7HYZ7HD txn_3PFNevGtEGgLrOja0JIseutz Outdoor Class North
12/05/2024,15.00,sale STRIPE-W7HYZ7HD txn_3PFPDwGtEGgLrOja1pbFVuKD Youth Class 6-9
12/05/2024,-0.43,fee STRIPE-W7HYZ7HD txn_3PFPDwGtEGgLrOja1pbFVuKD Youth Class 6-9
12/05/2024,30.00,sale STRIPE-W7HYZ7HD txn_3PFW6iGtEGgLrOja18QpEcfe Youth Class 6-9
12/05/2024,-0.65,fee STRIPE-W7HYZ7HD txn_3PFW6iGtEGgLrOja18QpEcfe Youth Class 6-9
12/05/2024,15.00,sale STRIPE-W7HYZ7HD txn_3PFgY6GtEGgLrOja1aZOu15z Youth Decathlon
12/05/2024,-0.43,fee STRIPE-W7HYZ7HD txn_3PFgY6GtEGgLrOja1aZOu15z Youth Decathlon
13/05/2024,15.00,sale STRIPE-W7HYZ7HD txn_3PFrYaGtEGgLrOja16zBZLhN Adult Decathlon
13/05/2024,-0.43,fee STRIPE-W7HYZ7HD txn_3PFrYaGtEGgLrOja16zBZLhN Adult Decathlon
13/05/2024,15.00,sale STRIPE-W7HYZ7HD txn_3PFx02GtEGgLrOja0uGsKuf2 Adult Decathlon
13/05/2024,-0.43,fee STRIPE-W7HYZ7HD txn_3PFx02GtEGgLrOja0uGsKuf2 Adult Decathlon
13/05/2024,15.00,sale STRIPE-W7HYZ7HD txn_3PG0gKGtEGgLrOja0g2a7KM9 Youth Decathlon
13/05/2024,-0.43,fee STRIPE-W7HYZ7HD txn_3PG0gKGtEGgLrOja0g2a7KM9 Youth Decathlon
13/05/2024,0.00,stripe debit STRIPE-G0DSRXNAGFW3LLA4VHEFMSRED9BI po_1PEOpoGtEGgLrOjaMr2fotDV
15/05/2024,20.00,sale STRIPE-XSGIV3K1 txn_3PGfdsGtEGgLrOja01DOxbyt Outdoor Class East
15/05/2024,-0.50,fee STRIPE-XSGIV3K1 txn_3PGfdsGtEGgLrOja01DOxbyt Outdoor Class East
15/05/2024,60.00,sale STRIPE-XSGIV3K1 txn_3PGkJ1GtEGgLrOja1CWP09Yp Private Booking
15/05/2024,-1.10,fee STRIPE-XSGIV3K1 txn_3PGkJ1GtEGgLrOja1CWP09Yp Private Booking
15/05/2024,15.00,sale STRIPE-XSGIV3K1 txn_3PGkt7GtEGgLrOja16tT7fpc Youth Class 6-9
15/05/2024,-0.43,fee STRIPE-XSGIV3K1 txn_3PGkt7GtEGgLrOja16tT7fpc Youth Class 6-9
15/05/2024,15.00,sale STRIPE-XSGIV3K1 txn_3PGmz6GtEGgLrOja03OOqdzT Youth Class 10-14
15/05/2024,-0.43,fee STRIPE-XSGIV3K1 txn_3PGmz6GtEGgLrOja03OOqdzT Youth Class 10-14
15/05/2024,0.00,stripe debit STRIPE-CX2FFHGK po_1PFoS6GtEGgLrOja4T6Wde6u
16/05/2024,30.00,sale STRIPE-SKFOUJCK txn_3PGyBKGtEGgLrOja04iEFMv3 Youth Class 6-9
16/05/2024,-0.65,fee STRIPE-SKFOUJCK txn_3PGyBKGtEGgLrOja04iEFMv3 Youth Class 6-9
16/05/2024,20.00,sale STRIPE-SKFOUJCK txn_3PH4gnGtEGgLrOja0tTRI3LQ Outdoor Class East
16/05/2024,-0.50,fee STRIPE-SKFOUJCK txn_3PH4gnGtEGgLrOja0tTRI3LQ Outdoor Class East
16/05/2024,0.00,stripe debit STRIPE-W7HYZ7HD po_1PGAl6GtEGgLrOjay2qcmBih
17/05/2024,30.00,sale STRIPE-5S0NKUTL txn_3PHLf8GtEGgLrOja0rV5Nl2i Youth Class 10-14
17/05/2024,-0.65,fee STRIPE-5S0NKUTL txn_3PHLf8GtEGgLrOja0rV5Nl2i Youth Class 10-14
17/05/2024,15.00,sale STRIPE-5S0NKUTL txn_3PHSJtGtEGgLrOja1gZPxyw2 Youth Class 6-9
17/05/2024,-0.43,fee STRIPE-5S0NKUTL txn_3PHSJtGtEGgLrOja1gZPxyw2 Youth Class 6-9
17/05/2024,15.00,sale STRIPE-5S0NKUTL txn_3PHTwaGtEGgLrOja0kLspHR4 Youth Decathlon
17/05/2024,-0.43,fee STRIPE-5S0NKUTL txn_3PHTwaGtEGgLrOja0kLspHR4 Youth Decathlon
17/05/2024,40.00,sale STRIPE-5S0NKUTL txn_3PHZdiGtEGgLrOja0hX5XYZB custom
17/05/2024,-0.80,fee STRIPE-5S0NKUTL txn_3PHZdiGtEGgLrOja0hX5XYZB custom
17/05/2024,10.00,sale STRIPE-5S0NKUTL txn_3PHZe8GtEGgLrOja13xP3vHy Outdoor Class East
17/05/2024,-0.35,fee STRIPE-5S0NKUTL txn_3PHZe8GtEGgLrOja13xP3vHy Outdoor Class East
18/05/2024,10.00,sale STRIPE-UYEJRX00 txn_3PHajTGtEGgLrOja0QKxTkw9 Outdoor Class East
18/05/2024,-0.35,fee STRIPE-UYEJRX00 txn_3PHajTGtEGgLrOja0QKxTkw9 Outdoor Class East
18/05/2024,10.00,sale STRIPE-UYEJRX00 txn_3PHhUdGtEGgLrOja1EulL6yO Outdoor Class East
18/05/2024,-0.35,fee STRIPE-UYEJRX00 txn_3PHhUdGtEGgLrOja1EulL6yO Outdoor Class East
18/05/2024,10.00,sale STRIPE-UYEJRX00 txn_3PHhVhGtEGgLrOja1FU2sU9V Outdoor Class East
18/05/2024,-0.35,fee STRIPE-UYEJRX00 txn_3PHhVhGtEGgLrOja1FU2sU9V Outdoor Class East
18/05/2024,10.00,sale STRIPE-UYEJRX00 txn_3PHhdBGtEGgLrOja1r5ThcCI Outdoor Class East
18/05/2024,-0.35,fee STRIPE-UYEJRX00 txn_3PHhdBGtEGgLrOja1r5ThcCI Outdoor Class East
18/05/2024,10.00,sale STRIPE-UYEJRX00 txn_3PHjWxGtEGgLrOja0c4Ptxen Outdoor Class East
18/05/2024,-0.35,fee STRIPE-UYEJRX00 txn_3PHjWxGtEGgLrOja0c4Ptxen Outdoor Class East
18/05/2024,15.00,sale STRIPE-UYEJRX00 txn_3PHkvLGtEGgLrOja1rfy3HQM Youth Class 10-14
18/05/2024,-0.43,fee STRIPE-UYEJRX00 txn_3PHkvLGtEGgLrOja1rfy3HQM Youth Class 10-14
18/05/2024,15.00,sale STRIPE-UYEJRX00 txn_3PHnEzGtEGgLrOja0t6FJ6Px Youth Class 10-14
18/05/2024,-0.43,fee STRIPE-UYEJRX00 txn_3PHnEzGtEGgLrOja0t6FJ6Px Youth Class 10-14
18/05/2024,15.00,sale STRIPE-UYEJRX00 txn_3PHusBGtEGgLrOja0UgW0aw6 Youth Class 6-9
18/05/2024,-0.43,fee STRIPE-UYEJRX00 txn_3PHusBGtEGgLrOja0UgW0aw6 Youth Class 6-9
18/05/2024,45.00,sale STRIPE-UYEJRX00 txn_3PHvCyGtEGgLrOja1YyfSqJl Youth Class 6-9
18/05/2024,-0.88,fee STRIPE-UYEJRX00 txn_3PHvCyGtEGgLrOja1YyfSqJl Youth Class 6-9
18/05/2024,10.00,sale STRIPE-UYEJRX00 txn_3PHvEzGtEGgLrOja1FLGayBo Outdoor Class North
18/05/2024,-0.35,fee STRIPE-UYEJRX00 txn_3PHvEzGtEGgLrOja1FLGayBo Outdoor Class North
18/05/2024,15.00,sale STRIPE-UYEJRX00 txn_3PHvqxGtEGgLrOja13g0CQYu Youth Class 10-14
18/05/2024,-0.43,fee STRIPE-UYEJRX00 txn_3PHvqxGtEGgLrOja13g0CQYu Youth Class 10-14
18/05/2024,15.00,sale STRIPE-UYEJRX00 txn_3PHw0UGtEGgLrOja1RQcgSL1 Youth Class 6-9
18/05/2024,-0.43,fee STRIPE-UYEJRX00 txn_3PHw0UGtEGgLrOja1RQcgSL1 Youth Class 6-9
19/05/2024,15.00,sale STRIPE-UYEJRX00 txn_3PICuQGtEGgLrOja0uAMLCPf Youth Decathlon
19/05/2024,-0.43,fee STRIPE-UYEJRX00 txn_3PICuQGtEGgLrOja0uAMLCPf Youth Decathlon
20/05/2024,15.00,sale STRIPE-UYEJRX00 txn_3PIV24GtEGgLrOja1h5GfegX Adult Decathlon
20/05/2024,-0.43,fee STRIPE-UYEJRX00 txn_3PIV24GtEGgLrOja1h5GfegX Adult Decathlon
20/05/2024,15.00,sale STRIPE-UYEJRX00 txn_3PIVdVGtEGgLrOja0ODeiV8c Adult Decathlon
20/05/2024,-0.43,fee STRIPE-UYEJRX00 txn_3PIVdVGtEGgLrOja0ODeiV8c Adult Decathlon
20/05/2024,15.00,sale STRIPE-UYEJRX00 txn_3PIYtDGtEGgLrOja0z0ZFYh0 Youth Decathlon
20/05/2024,-0.43,fee STRIPE-UYEJRX00 txn_3PIYtDGtEGgLrOja0z0ZFYh0 Youth Decathlon
20/05/2024,10.00,sale STRIPE-UYEJRX00 txn_3PIYzlGtEGgLrOja1mZl1gI2 Adult Decathlon
20/05/2024,-0.35,fee STRIPE-UYEJRX00 txn_3PIYzlGtEGgLrOja1mZl1gI2 Adult Decathlon
20/05/2024,0.00,stripe debit STRIPE-XSGIV3K1 po_1PGwEkGtEGgLrOjaGMaKT18b
21/05/2024,0.00,stripe debit STRIPE-SKFOUJCK po_1PHFu3GtEGgLrOjaz9KgnKWF
22/05/2024,0.00,stripe debit STRIPE-5S0NKUTL po_1PILuQGtEGgLrOjaT8FNL9fR
23/05/2024,10.00,sale STRIPE-VWMMBZZR txn_3PJgWRGtEGgLrOja1KyYUSEw Outdoor Class East
23/05/2024,-0.35,fee STRIPE-VWMMBZZR txn_3PJgWRGtEGgLrOja1KyYUSEw Outdoor Class East
23/05/2024,0.00,stripe debit STRIPE-UYEJRX00 po_1PIhwEGtEGgLrOjaP3pk3guE
24/05/2024,10.00,sale STRIPE-ZZDDMCT4 txn_3PK713GtEGgLrOja0flOjBU6 Outdoor Class East
24/05/2024,-0.35,fee STRIPE-ZZDDMCT4 txn_3PK713GtEGgLrOja0flOjBU6 Outdoor Class East
25/05/2024,10.00,sale STRIPE-ZZDDMCT4 txn_3PK76QGtEGgLrOja11bkrEzQ Outdoor Class East
25/05/2024,-0.35,fee STRIPE-ZZDDMCT4 txn_3PK76QGtEGgLrOja11bkrEzQ Outdoor Class East
25/05/2024,60.00,sale STRIPE-ZZDDMCT4 txn_3PK76uGtEGgLrOja0PcFQxLy Private Booking
25/05/2024,-1.10,fee STRIPE-ZZDDMCT4 txn_3PK76uGtEGgLrOja0PcFQxLy Private Booking
25/05/2024,10.00,sale STRIPE-TGCLL3L7 txn_3PKF38GtEGgLrOja0pGV0rbp Outdoor Class East
25/05/2024,-0.35,fee STRIPE-TGCLL3L7 txn_3PKF38GtEGgLrOja0pGV0rbp Outdoor Class East
25/05/2024,10.00,sale STRIPE-TGCLL3L7 txn_3PKFOSGtEGgLrOja0HMZkKbZ Outdoor Class East
25/05/2024,-0.35,fee STRIPE-TGCLL3L7 txn_3PKFOSGtEGgLrOja0HMZkKbZ Outdoor Class East
25/05/2024,10.00,sale STRIPE-TGCLL3L7 txn_3PKFqhGtEGgLrOja0qvtrgWk Outdoor Class East
25/05/2024,-0.35,fee STRIPE-TGCLL3L7 txn_3PKFqhGtEGgLrOja0qvtrgWk Outdoor Class East
26/05/2024,10.00,sale STRIPE-TGCLL3L7 txn_3PKUe2GtEGgLrOja1OcFwM0i Outdoor Class North
26/05/2024,-0.35,fee STRIPE-TGCLL3L7 txn_3PKUe2GtEGgLrOja1OcFwM0i Outdoor Class North
26/05/2024,15.00,sale STRIPE-TGCLL3L7 txn_3PKl2bGtEGgLrOja1YpaDkqv Youth Class 10-14
26/05/2024,-0.43,fee STRIPE-TGCLL3L7 txn_3PKl2bGtEGgLrOja1YpaDkqv Youth Class 10-14
29/05/2024,60.00,sale STRIPE-GVLFO0LS txn_3PLjbGGtEGgLrOja0IoaL9I1 Private Booking
29/05/2024,-1.10,fee STRIPE-GVLFO0LS txn_3PLjbGGtEGgLrOja0IoaL9I1 Private Booking
29/05/2024,0.00,stripe debit STRIPE-VWMMBZZR po_1PJnqpGtEGgLrOjalh69E6sY
30/05/2024,0.00,stripe debit STRIPE-ZZDDMCT4 po_1PLG5GGtEGgLrOja5iv9QTJ0
31/05/2024,30.00,sale STRIPE-F1SN1N0W txn_3PMQaWGtEGgLrOja1WphFB5m Youth Class 10-14
31/05/2024,-0.65,fee STRIPE-F1SN1N0W txn_3PMQaWGtEGgLrOja1WphFB5m Youth Class 10-14
31/05/2024,10.00,sale STRIPE-F1SN1N0W txn_3PMdH8GtEGgLrOja047VKNxT Outdoor Class East
31/05/2024,-0.35,fee STRIPE-F1SN1N0W txn_3PMdH8GtEGgLrOja047VKNxT Outdoor Class East
31/05/2024,0.00,stripe debit STRIPE-TGCLL3L7 po_1PLc0MGtEGgLrOja3BEcpQwe
01/06/2024,10.00,sale STRIPE-AWZKZGYE txn_3PMlXEGtEGgLrOja0W9dYvyU Outdoor Class East
01/06/2024,-0.35,fee STRIPE-AWZKZGYE txn_3PMlXEGtEGgLrOja0W9dYvyU Outdoor Class East
01/06/2024,10.00,sale STRIPE-AWZKZGYE txn_3PMmjSGtEGgLrOja1Coo6Hkv Outdoor Class East
01/06/2024,-0.35,fee STRIPE-AWZKZGYE txn_3PMmjSGtEGgLrOja1Coo6Hkv Outdoor Class East
01/06/2024,10.00,sale STRIPE-AWZKZGYE txn_3PMmyfGtEGgLrOja1sexQfaU Outdoor Class East
01/06/2024,-0.35,fee STRIPE-AWZKZGYE txn_3PMmyfGtEGgLrOja1sexQfaU Outdoor Class East
01/06/2024,10.00,sale STRIPE-AWZKZGYE txn_3PMn58GtEGgLrOja0G4Izhm4 Outdoor Class East
01/06/2024,-0.35,fee STRIPE-AWZKZGYE txn_3PMn58GtEGgLrOja0G4Izhm4 Outdoor Class East
01/06/2024,20.00,sale STRIPE-AWZKZGYE txn_3PMnRUGtEGgLrOja1B7s1JTV Outdoor Class East
01/06/2024,-0.50,fee STRIPE-AWZKZGYE txn_3PMnRUGtEGgLrOja1B7s1JTV Outdoor Class East
01/06/2024,15.00,sale STRIPE-AWZKZGYE txn_3PMrdeGtEGgLrOja185LHwul Youth Class 10-14
01/06/2024,-0.43,fee STRIPE-AWZKZGYE txn_3PMrdeGtEGgLrOja185LHwul Youth Class 10-14
01/06/2024,20.00,sale STRIPE-AWZKZGYE txn_3PMwvCGtEGgLrOja0BQxfHPk Outdoor Class East
01/06/2024,-0.50,fee STRIPE-AWZKZGYE txn_3PMwvCGtEGgLrOja0BQxfHPk Outdoor Class East
01/06/2024,15.00,sale STRIPE-AWZKZGYE txn_3PN0ttGtEGgLrOja1KLwCGsF Youth Class 6-9
01/06/2024,-0.43,fee STRIPE-AWZKZGYE txn_3PN0ttGtEGgLrOja1KLwCGsF Youth Class 6-9
02/06/2024,15.00,sale STRIPE-AWZKZGYE txn_3PNLr6GtEGgLrOja0gYTW2ed Youth Decathlon
02/06/2024,-0.43,fee STRIPE-AWZKZGYE txn_3PNLr6GtEGgLrOja0gYTW2ed Youth Decathlon
02/06/2024,15.00,sale STRIPE-AWZKZGYE txn_3PNMmzGtEGgLrOja1KfIQI7W Adult Decathlon
02/06/2024,-0.43,fee STRIPE-AWZKZGYE txn_3PNMmzGtEGgLrOja1KfIQI7W Adult Decathlon
03/06/2024,15.00,sale STRIPE-AWZKZGYE txn_3PNUInGtEGgLrOja0vO5EgCw Adult Decathlon
03/06/2024,-0.43,fee STRIPE-AWZKZGYE txn_3PNUInGtEGgLrOja0vO5EgCw Adult Decathlon
03/06/2024,30.00,sale STRIPE-AWZKZGYE txn_3PNWSiGtEGgLrOja0R3TDWIA Youth Decathlon
03/06/2024,-0.65,fee STRIPE-AWZKZGYE txn_3PNWSiGtEGgLrOja0R3TDWIA Youth Decathlon
03/06/2024,10.00,sale STRIPE-AWZKZGYE txn_3PNZufGtEGgLrOja1BltgVLc Outdoor Class East
03/06/2024,-0.35,fee STRIPE-AWZKZGYE txn_3PNZufGtEGgLrOja1BltgVLc Outdoor Class East
03/06/2024,30.00,sale STRIPE-AWZKZGYE txn_3PNaCeGtEGgLrOja1ZIQjiC5 Youth Decathlon
03/06/2024,-0.65,fee STRIPE-AWZKZGYE txn_3PNaCeGtEGgLrOja1ZIQjiC5 Youth Decathlon
03/06/2024,15.00,sale STRIPE-AWZKZGYE txn_3PNancGtEGgLrOja11r684WF Adult Decathlon
03/06/2024,-0.43,fee STRIPE-AWZKZGYE txn_3PNancGtEGgLrOja11r684WF Adult Decathlon
03/06/2024,15.00,sale STRIPE-AWZKZGYE txn_3PNcukGtEGgLrOja0uLLXHyg Adult Decathlon
03/06/2024,-0.43,fee STRIPE-AWZKZGYE txn_3PNcukGtEGgLrOja0uLLXHyg Adult Decathlon
03/06/2024,15.00,sale STRIPE-AWZKZGYE txn_3PNd3VGtEGgLrOja1H0tWxKt Adult Decathlon
03/06/2024,-0.43,fee STRIPE-AWZKZGYE txn_3PNd3VGtEGgLrOja1H0tWxKt Adult Decathlon
03/06/2024,15.00,sale STRIPE-AWZKZGYE txn_3PNdABGtEGgLrOja1vizZf47 Youth Decathlon
03/06/2024,-0.43,fee STRIPE-AWZKZGYE txn_3PNdABGtEGgLrOja1vizZf47 Youth Decathlon
03/06/2024,10.00,sale STRIPE-AWZKZGYE txn_3PNdaVGtEGgLrOja0gQcmvmr Adult Decathlon
03/06/2024,-0.35,fee STRIPE-AWZKZGYE txn_3PNdaVGtEGgLrOja0gQcmvmr Adult Decathlon
03/06/2024,0.00,stripe debit STRIPE-GVLFO0LS po_1PM0w5GtEGgLrOjaAULeiKQw
04/06/2024,15.00,sale STRIPE-TSRVUEKY txn_3PNwXlGtEGgLrOja1OmtDD6q Youth Class 6-9
04/06/2024,-0.43,fee STRIPE-TSRVUEKY txn_3PNwXlGtEGgLrOja1OmtDD6q Youth Class 6-9
05/06/2024,60.00,sale STRIPE-PUODIXBP txn_3POHWbGtEGgLrOja0cftvLhc Private Booking
05/06/2024,-1.10,fee STRIPE-PUODIXBP txn_3POHWbGtEGgLrOja0cftvLhc Private Booking
05/06/2024,15.00,sale STRIPE-PUODIXBP txn_3PORwfGtEGgLrOja1R81hERH Youth Class 10-14
05/06/2024,-0.43,fee STRIPE-PUODIXBP txn_3PORwfGtEGgLrOja1R81hERH Youth Class 10-14
05/06/2024,0.00,stripe debit STRIPE-F1SN1N0W po_1PNQioGtEGgLrOja2OGTri5a
06/06/2024,0.00,stripe debit STRIPE-AWZKZGYE po_1PNmyPGtEGgLrOjaTBXBtnmY
07/06/2024,30.00,sale STRIPE-YESWKGLZ txn_3POwgWGtEGgLrOja0GxnTf8p Youth Class 6-9
07/06/2024,-0.65,fee STRIPE-YESWKGLZ txn_3POwgWGtEGgLrOja0GxnTf8p Youth Class 6-9
07/06/2024,10.00,sale STRIPE-YESWKGLZ txn_3PP4gTGtEGgLrOja1L8NsCKr Outdoor Class East
07/06/2024,-0.35,fee STRIPE-YESWKGLZ txn_3PP4gTGtEGgLrOja1L8NsCKr Outdoor Class East
07/06/2024,10.00,sale STRIPE-YESWKGLZ txn_3PPAc0GtEGgLrOja1z9AUWEQ Outdoor Class East
07/06/2024,-0.35,fee STRIPE-YESWKGLZ txn_3PPAc0GtEGgLrOja1z9AUWEQ Outdoor Class East
07/06/2024,40.00,sale STRIPE-YESWKGLZ txn_3PPBbjGtEGgLrOja1bbDkWvp custom
07/06/2024,-0.80,fee STRIPE-YESWKGLZ txn_3PPBbjGtEGgLrOja1bbDkWvp custom
07/06/2024,10.00,sale STRIPE-YESWKGLZ txn_3PPBcBGtEGgLrOja0Tlf40yU Outdoor Class East
07/06/2024,-0.35,fee STRIPE-YESWKGLZ txn_3PPBcBGtEGgLrOja0Tlf40yU Outdoor Class East
07/06/2024,0.00,stripe debit STRIPE-TSRVUEKY po_1POC8SGtEGgLrOjap4zFEX1i
08/06/2024,10.00,sale STRIPE-YBQGNNPY txn_3PPEdpGtEGgLrOja1debdbrE Outdoor Class East
08/06/2024,-0.35,fee STRIPE-YBQGNNPY txn_3PPEdpGtEGgLrOja1debdbrE Outdoor Class East
08/06/2024,10.00,sale STRIPE-YBQGNNPY txn_3PPKJnGtEGgLrOja0m3dWBeM Outdoor Class East
08/06/2024,-0.35,fee STRIPE-YBQGNNPY txn_3PPKJnGtEGgLrOja0m3dWBeM Outdoor Class East
08/06/2024,15.00,sale STRIPE-YBQGNNPY txn_3PPKTcGtEGgLrOja0Bxd8vEe Youth Class 6-9
08/06/2024,-0.43,fee STRIPE-YBQGNNPY txn_3PPKTcGtEGgLrOja0Bxd8vEe Youth Class 6-9
08/06/2024,10.00,sale STRIPE-YBQGNNPY txn_3PPLTUGtEGgLrOja0N8nzYcc Outdoor Class East
08/06/2024,-0.35,fee STRIPE-YBQGNNPY txn_3PPLTUGtEGgLrOja0N8nzYcc Outdoor Class East
08/06/2024,15.00,sale STRIPE-YBQGNNPY txn_3PPROCGtEGgLrOja0wACCQW9 Youth Class 10-14
08/06/2024,-0.43,fee STRIPE-YBQGNNPY txn_3PPROCGtEGgLrOja0wACCQW9 Youth Class 10-14
08/06/2024,10.00,sale STRIPE-YBQGNNPY txn_3PPVvhGtEGgLrOja08AGGekD Outdoor Class North
08/06/2024,-0.35,fee STRIPE-YBQGNNPY txn_3PPVvhGtEGgLrOja08AGGekD Outdoor Class North
08/06/2024,15.00,sale STRIPE-YBQGNNPY txn_3PPW9RGtEGgLrOja0v47Nrhp Youth Class 6-9
08/06/2024,-0.43,fee STRIPE-YBQGNNPY txn_3PPW9RGtEGgLrOja0v47Nrhp Youth Class 6-9
08/06/2024,15.00,sale STRIPE-YBQGNNPY txn_3PPXDIGtEGgLrOja0fKOuyQ8 Youth Class 6-9
08/06/2024,-0.43,fee STRIPE-YBQGNNPY txn_3PPXDIGtEGgLrOja0fKOuyQ8 Youth Class 6-9
09/06/2024,10.00,sale STRIPE-YBQGNNPY txn_3PPg3nGtEGgLrOja0aGvDkOC Outdoor Class North
09/06/2024,-0.35,fee STRIPE-YBQGNNPY txn_3PPg3nGtEGgLrOja0aGvDkOC Outdoor Class North
09/06/2024,15.00,sale STRIPE-YBQGNNPY txn_3PPgjIGtEGgLrOja1XiszQ39 Youth Class 6-9
09/06/2024,-0.43,fee STRIPE-YBQGNNPY txn_3PPgjIGtEGgLrOja1XiszQ39 Youth Class 6-9
09/06/2024,10.00,sale STRIPE-YBQGNNPY txn_3PPgmLGtEGgLrOja1OMJo1eL Outdoor Class North
09/06/2024,-0.35,fee STRIPE-YBQGNNPY txn_3PPgmLGtEGgLrOja1OMJo1eL Outdoor Class North
09/06/2024,15.00,sale STRIPE-YBQGNNPY txn_3PPt8NGtEGgLrOja0Js5VHBc Youth Decathlon
09/06/2024,-0.43,fee STRIPE-YBQGNNPY txn_3PPt8NGtEGgLrOja0Js5VHBc Youth Decathlon
10/06/2024,15.00,sale STRIPE-YBQGNNPY txn_3PQAlqGtEGgLrOja1hU2umiM Adult Decathlon
10/06/2024,-0.43,fee STRIPE-YBQGNNPY txn_3PQAlqGtEGgLrOja1hU2umiM Adult Decathlon
10/06/2024,10.00,sale STRIPE-YBQGNNPY txn_3PQBA7GtEGgLrOja1Vs4fL0r Adult Decathlon
10/06/2024,-0.35,fee STRIPE-YBQGNNPY txn_3PQBA7GtEGgLrOja1Vs4fL0r Adult Decathlon
10/06/2024,50.00,sale STRIPE-YBQGNNPY txn_3PQBWYGtEGgLrOja04Kq2TIX Gift Card 5
10/06/2024,-0.95,fee STRIPE-YBQGNNPY txn_3PQBWYGtEGgLrOja04Kq2TIX Gift Card 5
10/06/2024,15.00,sale STRIPE-YBQGNNPY txn_3PQBYnGtEGgLrOja19ym7tAn Adult Decathlon
10/06/2024,-0.43,fee STRIPE-YBQGNNPY txn_3PQBYnGtEGgLrOja19ym7tAn Adult Decathlon
10/06/2024,0.00,stripe debit STRIPE-PUODIXBP po_1POYYCGtEGgLrOjamG7ECtuu
12/06/2024,60.00,sale STRIPE-4RXZRFIE txn_3PQpNsGtEGgLrOja1ZbKXf4J Private Booking
12/06/2024,-1.10,fee STRIPE-4RXZRFIE txn_3PQpNsGtEGgLrOja1ZbKXf4J Private Booking
12/06/2024,10.00,sale STRIPE-4RXZRFIE txn_3PQs6vGtEGgLrOja1EaxijMh Outdoor Class East
12/06/2024,-0.53,fee STRIPE-4RXZRFIE txn_3PQs6vGtEGgLrOja1EaxijMh Outdoor Class East
12/06/2024,120.00,sale STRIPE-4RXZRFIE txn_3PQxBsGtEGgLrOja1r7NzGFk Private Booking
12/06/2024,-2.00,fee STRIPE-4RXZRFIE txn_3PQxBsGtEGgLrOja1r7NzGFk Private Booking
12/06/2024,0.00,stripe debit STRIPE-YESWKGLZ po_1PPxu0GtEGgLrOjaDSmFvsxW
13/06/2024,0.00,stripe debit STRIPE-YBQGNNPY po_1PQK6HGtEGgLrOjaQATrr3Jp
14/06/2024,20.00,sale STRIPE-XZYESI1C txn_3PRdAqGtEGgLrOja1km9SMNS Outdoor Class East
14/06/2024,-0.50,fee STRIPE-XZYESI1C txn_3PRdAqGtEGgLrOja1km9SMNS Outdoor Class East
15/06/2024,10.00,sale STRIPE-N8TC2J6I txn_3PRrRiGtEGgLrOja1jPWT6eQ Outdoor Class East
15/06/2024,-0.35,fee STRIPE-N8TC2J6I txn_3PRrRiGtEGgLrOja1jPWT6eQ Outdoor Class East
15/06/2024,10.00,sale STRIPE-N8TC2J6I txn_3PRrwHGtEGgLrOja1fMV1eCU Outdoor Class East
15/06/2024,-0.35,fee STRIPE-N8TC2J6I txn_3PRrwHGtEGgLrOja1fMV1eCU Outdoor Class East
