28/09/2024,-0.35,fee STRIPE-YXB9FFKM txn_3Q3vbIGtEGgLrOja0PWDUjNz Outdoor Class East
28/09/2024,10.00,sale STRIPE-YXB9FFKM txn_3Q3vhOGtEGgLrOja0IGiOxmX Outdoor Class East
28/09/2024,-0.35,fee STRIPE-YXB9FFKM txn_3Q3vhOGtEGgLrOja0IGiOxmX Outdoor Class East
28/09/2024,10.00,sale STRIPE-YXB9FFKM txn_3Q3vmHGtEGgLrOja12SGNB3q Outdoor Class East
28/09/2024,-0.35,fee STRIPE-YXB9FFKM txn_3Q3vmHGtEGgLrOja12SGNB3q Outdoor Class East
28/09/2024,15.00,sale STRIPE-YXB9FFKM txn_3Q412NGtEGgLrOja03pqlhiH Youth Class 10-14
28/09/2024,-0.43,fee STRIPE-YXB9FFKM txn_3Q412NGtEGgLrOja03pqlhiH Youth Class 10-14
28/09/2024,30.00,sale STRIPE-YXB9FFKM txn_3Q42UnGtEGgLrOja1EULIzls Youth Class 10-14
28/09/2024,-0.65,fee STRIPE-YXB9FFKM txn_3Q42UnGtEGgLrOja1EULIzls Youth Class 10-14
28/09/2024,15.00,sale STRIPE-YXB9FFKM txn_3Q44w9GtEGgLrOja1dKQhtpm Youth Class 6-9
28/09/2024,-0.43,fee STRIPE-YXB9FFKM txn_3Q44w9GtEGgLrOja1dKQhtpm Youth Class 6-9
28/09/2024,15.00,sale STRIPE-YXB9FFKM txn_3Q45v5GtEGgLrOja0o0f8C6P Youth Class 10-14
28/09/2024,-0.43,fee STRIPE-YXB9FFKM txn_3Q45v5GtEGgLrOja0o0f8C6P Youth Class 10-14
28/09/2024,30.00,sale STRIPE-YXB9FFKM txn_3Q460HGtEGgLrOja0uCBrp6j Youth Class 6-9
28/09/2024,-0.56,fee STRIPE-YXB9FFKM txn_3Q460HGtEGgLrOja0uCBrp6j Youth Class 6-9
28/09/2024,15.00,sale STRIPE-YXB9FFKM txn_3Q47mpGtEGgLrOja1tNqymIz Youth Class 6-9
28/09/2024,-0.43,fee STRIPE-YXB9FFKM txn_3Q47mpGtEGgLrOja1tNqymIz Youth Class 6-9
29/09/2024,30.00,sale STRIPE-YXB9FFKM txn_3Q4Gh9GtEGgLrOja1vvM2YFO Youth Class 6-9
29/09/2024,-0.65,fee STRIPE-YXB9FFKM txn_3Q4Gh9GtEGgLrOja1vvM2YFO Youth Class 6-9
29/09/2024,15.00,sale STRIPE-YXB9FFKM txn_3Q4HrqGtEGgLrOja1pqetjIB Youth Class 6-9
29/09/2024,-0.43,fee STRIPE-YXB9FFKM txn_3Q4HrqGtEGgLrOja1pqetjIB Youth Class 6-9
29/09/2024,15.00,sale STRIPE-YXB9FFKM txn_3Q4HtDGtEGgLrOja1wCGMPMj Youth Class 6-9
29/09/2024,-0.43,fee STRIPE-YXB9FFKM txn_3Q4HtDGtEGgLrOja1wCGMPMj Youth Class 6-9
29/09/2024,15.00,sale STRIPE-YXB9FFKM txn_3Q4INaGtEGgLrOja0eh0ADKd Youth Class 10-14
29/09/2024,-0.43,fee STRIPE-YXB9FFKM txn_3Q4INaGtEGgLrOja0eh0ADKd Youth Class 10-14
29/09/2024,15.00,sale STRIPE-YXB9FFKM txn_3Q4NVWGtEGgLrOja1M5ygXo7 Youth Decathlon
29/09/2024,-0.38,fee STRIPE-YXB9FFKM txn_3Q4NVWGtEGgLrOja1M5ygXo7 Youth Decathlon
29/09/2024,15.00,sale STRIPE-YXB9FFKM txn_3Q4PaOGtEGgLrOja1xd79817 Youth Decathlon
29/09/2024,-0.43,fee STRIPE-YXB9FFKM txn_3Q4PaOGtEGgLrOja1xd79817 Youth Decathlon
29/09/2024,15.00,sale STRIPE-YXB9FFKM txn_3Q4PxOGtEGgLrOja1gMh27fI Youth Class East 8-14
29/09/2024,-0.43,fee STRIPE-YXB9FFKM txn_3Q4PxOGtEGgLrOja1gMh27fI Youth Class East 8-14
29/09/2024,15.00,sale STRIPE-YXB9FFKM txn_3Q4QRiGtEGgLrOja0FMIwKY2 Youth Decathlon
29/09/2024,-0.43,fee STRIPE-YXB9FFKM txn_3Q4QRiGtEGgLrOja0FMIwKY2 Youth Decathlon
29/09/2024,15.00,sale STRIPE-YXB9FFKM txn_3Q4SSiGtEGgLrOja1kV1HkWW Youth Decathlon
29/09/2024,-0.43,fee STRIPE-YXB9FFKM txn_3Q4SSiGtEGgLrOja1kV1HkWW Youth Decathlon
30/09/2024,100.00,sale STRIPE-YXB9FFKM txn_3Q4dGYGtEGgLrOja0VkXhUZP Gift Card 11
30/09/2024,-1.70,fee STRIPE-YXB9FFKM txn_3Q4dGYGtEGgLrOja0VkXhUZP Gift Card 11
30/09/2024,15.00,sale STRIPE-YXB9FFKM txn_3Q4jPpGtEGgLrOja1sYq0qlu Adult Decathlon
30/09/2024,-0.43,fee STRIPE-YXB9FFKM txn_3Q4jPpGtEGgLrOja1sYq0qlu Adult Decathlon
30/09/2024,15.00,sale STRIPE-YXB9FFKM txn_3Q4mehGtEGgLrOja1zpDlJ41 Youth Decathlon
30/09/2024,-0.43,fee STRIPE-YXB9FFKM txn_3Q4mehGtEGgLrOja1zpDlJ41 Youth Decathlon
30/09/2024,0.00,stripe debit STRIPE-0JHA2KBV po_1Q38thGtEGgLrOjaswVnpNAq
01/10/2024,15.00,sale STRIPE-4OPTCJA1 txn_3Q52GCGtEGgLrOja08BeCDXO Youth Decathlon
01/10/2024,-0.43,fee STRIPE-4OPTCJA1 txn_3Q52GCGtEGgLrOja08BeCDXO Youth Decathlon
01/10/2024,0.00,stripe debit STRIPE-JN54ZSCM po_1Q3TgoGtEGgLrOjaz8gXWVTU
02/10/2024,0.00,stripe debit STRIPE-PHZTIQAI po_1Q4aGgGtEGgLrOjaaNc73Zhu
03/10/2024,0.00,stripe debit STRIPE-YXB9FFKM po_1Q4w7FGtEGgLrOjaBOMySZRT
04/10/2024,10.00,sale STRIPE-K3DYEGIH txn_3Q64AqGtEGgLrOja0k9UhPow Outdoor Class East
04/10/2024,-0.35,fee STRIPE-K3DYEGIH txn_3Q64AqGtEGgLrOja0k9UhPow Outdoor Class East
04/10/2024,15.00,sale STRIPE-K3DYEGIH txn_3Q6DNOGtEGgLrOja0voaaTv6 Youth Decathlon
04/10/2024,-0.43,fee STRIPE-K3DYEGIH txn_3Q6DNOGtEGgLrOja0voaaTv6 Youth Decathlon
04/10/2024,30.00,sale STRIPE-K3DYEGIH txn_3Q6IATGtEGgLrOja1CNu7COM Youth Class East 8-14
04/10/2024,-0.65,fee STRIPE-K3DYEGIH txn_3Q6IATGtEGgLrOja1CNu7COM Youth Class East 8-14
04/10/2024,0.00,stripe debit STRIPE-4OPTCJA1 po_1Q5KLfGtEGgLrOjaJfAKrhUB
05/10/2024,10.00,sale STRIPE-7NUZV5NE txn_3Q6RVyGtEGgLrOja020WfYq5 Outdoor Class East
05/10/2024,-0.35,fee STRIPE-7NUZV5NE txn_3Q6RVyGtEGgLrOja020WfYq5 Outdoor Class East
05/10/2024,15.00,sale STRIPE-7NUZV5NE txn_3Q6SQ7GtEGgLrOja1nMrrYWo Youth Class East 8-14
05/10/2024,-0.43,fee STRIPE-7NUZV5NE txn_3Q6SQ7GtEGgLrOja1nMrrYWo Youth Class East 8-14
05/10/2024,10.00,sale STRIPE-7NUZV5NE txn_3Q6Sv7GtEGgLrOja1j2HFeeU Outdoor Class East
05/10/2024,-0.35,fee STRIPE-7NUZV5NE txn_3Q6Sv7GtEGgLrOja1j2HFeeU Outdoor Class East
05/10/2024,10.00,sale STRIPE-7NUZV5NE txn_3Q6TImGtEGgLrOja1OWhPKQx Outdoor Class East
05/10/2024,-0.35,fee STRIPE-7NUZV5NE txn_3Q6TImGtEGgLrOja1OWhPKQx Outdoor Class East
05/10/2024,15.00,sale STRIPE-7NUZV5NE txn_3Q6X4AGtEGgLrOja04z0e1nt Youth Class 6-9
05/10/2024,-0.43,fee STRIPE-7NUZV5NE txn_3Q6X4AGtEGgLrOja04z0e1nt Youth Class 6-9
05/10/2024,15.00,sale STRIPE-7NUZV5NE txn_3Q6Ye3GtEGgLrOja0uISrxcE Youth Class 10-14
05/10/2024,-0.43,fee STRIPE-7NUZV5NE txn_3Q6Ye3GtEGgLrOja0uISrxcE Youth Class 10-14
05/10/2024,50.00,sale STRIPE-7NUZV5NE txn_3Q6a4xGtEGgLrOja1unbN7vW Gift Card 5
05/10/2024,-0.95,fee STRIPE-7NUZV5NE txn_3Q6a4xGtEGgLrOja1unbN7vW Gift Card 5
05/10/2024,10.00,sale STRIPE-7NUZV5NE txn_3Q6d0kGtEGgLrOja0FHZbvOM Outdoor Class North
05/10/2024,-0.35,fee STRIPE-7NUZV5NE txn_3Q6d0kGtEGgLrOja0FHZbvOM Outdoor Class North
05/10/2024,15.00,sale STRIPE-7NUZV5NE txn_3Q6eEPGtEGgLrOja07PhMfHg Youth Class 10-14
05/10/2024,-0.43,fee STRIPE-7NUZV5NE txn_3Q6eEPGtEGgLrOja07PhMfHg Youth Class 10-14
05/10/2024,15.00,sale STRIPE-7NUZV5NE txn_3Q6eWCGtEGgLrOja0ZlDPUdx Youth Class 6-9
05/10/2024,-0.43,fee STRIPE-7NUZV5NE txn_3Q6eWCGtEGgLrOja0ZlDPUdx Youth Class 6-9
06/10/2024,15.00,sale STRIPE-7NUZV5NE txn_3Q6pAIGtEGgLrOja1txHTNg2 Youth Class 6-9
06/10/2024,-0.43,fee STRIPE-7NUZV5NE txn_3Q6pAIGtEGgLrOja1txHTNg2 Youth Class 6-9
06/10/2024,15.00,sale STRIPE-7NUZV5NE txn_3Q6pGAGtEGgLrOja1UCNDHeN Youth Decathlon
06/10/2024,-0.43,fee STRIPE-7NUZV5NE txn_3Q6pGAGtEGgLrOja1UCNDHeN Youth Decathlon
06/10/2024,15.00,sale STRIPE-7NUZV5NE txn_3Q6ps2GtEGgLrOja0PdRaZu9 Youth Class 10-14
06/10/2024,-0.43,fee STRIPE-7NUZV5NE txn_3Q6ps2GtEGgLrOja0PdRaZu9 Youth Class 10-14
07/10/2024,15.00,sale STRIPE-7NUZV5NE txn_3Q7JlQGtEGgLrOja1k0EcXTA Youth Decathlon
07/10/2024,-0.43,fee STRIPE-7NUZV5NE txn_3Q7JlQGtEGgLrOja1k0EcXTA Youth Decathlon
07/10/2024,15.00,sale STRIPE-7NUZV5NE txn_3Q7KBnGtEGgLrOja1nwJ5J9E Adult Decathlon
07/10/2024,-0.43,fee STRIPE-7NUZV5NE txn_3Q7KBnGtEGgLrOja1nwJ5J9E Adult Decathlon
07/10/2024,50.00,sale STRIPE-7NUZV5NE txn_3Q7KUSGtEGgLrOja0fzlG5tm Gift Card 5
07/10/2024,-0.95,fee STRIPE-7NUZV5NE txn_3Q7KUSGtEGgLrOja0fzlG5tm Gift Card 5
07/10/2024,30.00,sale STRIPE-7NUZV5NE txn_3Q7KXwGtEGgLrOja1uCSoasU Youth Decathlon
07/10/2024,-0.65,fee STRIPE-7NUZV5NE txn_3Q7KXwGtEGgLrOja1uCSoasU Youth Decathlon
09/10/2024,30.00,refund STRIPE-FKXO7MXBXHV txn_3Q2A6ZGtEGgLrOja0QHkcm5o Youth Class 6-9
09/10/2024,0.00,stripe debit STRIPE-K3DYEGIH po_1Q76HiGtEGgLrOjaUC2c1W3O
10/10/2024,15.00,sale STRIPE-YY5GIKGE txn_3Q8G6qGtEGgLrOja1aMC5WUB Youth Class 6-9
10/10/2024,-0.43,fee STRIPE-YY5GIKGE txn_3Q8G6qGtEGgLrOja1aMC5WUB Youth Class 6-9
10/10/2024,0.00,stripe debit STRIPE-7NUZV5NE po_1Q7SfbGtEGgLrOjaDt8WhrC3
11/10/2024,10.00,sale STRIPE-UYME7VVB txn_3Q8cNOGtEGgLrOja0hmo4LXd Outdoor Class East
11/10/2024,-0.35,fee STRIPE-UYME7VVB txn_3Q8cNOGtEGgLrOja0hmo4LXd Outdoor Class East
11/10/2024,10.00,sale STRIPE-UYME7VVB txn_3Q8mykGtEGgLrOja0bDAjaMe Outdoor Class North
11/10/2024,-0.35,fee STRIPE-UYME7VVB txn_3Q8mykGtEGgLrOja0bDAjaMe Outdoor Class North
11/10/2024,15.00,sale STRIPE-UYME7VVB txn_3Q8ntmGtEGgLrOja0bINpf3M Youth Class 10-14
11/10/2024,-0.43,fee STRIPE-UYME7VVB txn_3Q8ntmGtEGgLrOja0bINpf3M Youth Class 10-14
12/10/2024,10.00,sale STRIPE-MIDM4E6G txn_3Q8z0tGtEGgLrOja1TeYpBgb Outdoor Class East
12/10/2024,-0.35,fee STRIPE-MIDM4E6G txn_3Q8z0tGtEGgLrOja1TeYpBgb Outdoor Class East
12/10/2024,10.00,sale STRIPE-MIDM4E6G txn_3Q90XgGtEGgLrOja1uQyJlNq Outdoor Class East
12/10/2024,-0.35,fee STRIPE-MIDM4E6G txn_3Q90XgGtEGgLrOja1uQyJlNq Outdoor Class East
12/10/2024,10.00,sale STRIPE-MIDM4E6G txn_3Q91brGtEGgLrOja0cydpUFk Outdoor Class East
12/10/2024,-0.35,fee STRIPE-MIDM4E6G txn_3Q91brGtEGgLrOja0cydpUFk Outdoor Class East
12/10/2024,10.00,sale STRIPE-MIDM4E6G txn_3Q95uTGtEGgLrOja0qsFljNp Outdoor Class North
12/10/2024,-0.35,fee STRIPE-MIDM4E6G txn_3Q95uTGtEGgLrOja0qsFljNp Outdoor Class North
12/10/2024,15.00,sale STRIPE-MIDM4E6G txn_3Q9BZ4GtEGgLrOja1rD60ERp Youth Class 6-9
12/10/2024,-0.43,fee STRIPE-MIDM4E6G txn_3Q9BZ4GtEGgLrOja1rD60ERp Youth Class 6-9
12/10/2024,15.00,sale STRIPE-MIDM4E6G txn_3Q9CRbGtEGgLrOja14Wcw6ep Youth Class 10-14
12/10/2024,-0.43,fee STRIPE-MIDM4E6G txn_3Q9CRbGtEGgLrOja14Wcw6ep Youth Class 10-14
13/10/2024,10.00,sale STRIPE-MIDM4E6G txn_3Q9NHqGtEGgLrOja0xmMFe4y Outdoor Class North
13/10/2024,-0.35,fee STRIPE-MIDM4E6G txn_3Q9NHqGtEGgLrOja0xmMFe4y Outdoor Class North
13/10/2024,15.00,sale STRIPE-MIDM4E6G txn_3Q9OIGGtEGgLrOja0mVoPjyL Youth Class 6-9
13/10/2024,-0.43,fee STRIPE-MIDM4E6G txn_3Q9OIGGtEGgLrOja0mVoPjyL Youth Class 6-9
13/10/2024,20.00,sale STRIPE-MIDM4E6G txn_3Q9RM0GtEGgLrOja0pPJwKSH custom
13/10/2024,-0.50,fee STRIPE-MIDM4E6G txn_3Q9RM0GtEGgLrOja0pPJwKSH custom
13/10/2024,15.00,sale STRIPE-MIDM4E6G txn_3Q9UZtGtEGgLrOja1XBvLPHg Youth Class East 8-14
13/10/2024,-0.43,fee STRIPE-MIDM4E6G txn_3Q9UZtGtEGgLrOja1XBvLPHg Youth Class East 8-14
14/10/2024,15.00,refund STRIPE-MIDM4E6G txn_3Q52GCGtEGgLrOja02pRK3F5 Youth Decathlon
14/10/2024,0.00,stripe debit STRIPE-FKXO7MXBXHV po_1Q8EMsGtEGgLrOjamkPYhNH5
15/10/2024,0.00,stripe debit STRIPE-YY5GIKGE po_1Q8XugGtEGgLrOjalMMBFbCU
16/10/2024,0.00,stripe debit STRIPE-UYME7VVB po_1Q9fzFGtEGgLrOjaHIJj5PXW
17/10/2024,10.00,sale STRIPE-A2NHR3EA txn_3QApu6GtEGgLrOja0tQyu73a Outdoor Class East
17/10/2024,-0.35,fee STRIPE-A2NHR3EA txn_3QApu6GtEGgLrOja0tQyu73a Outdoor Class East
17/10/2024,15.00,sale STRIPE-A2NHR3EA txn_3QAvchGtEGgLrOja09zeUbdv Youth Class 6-9
17/10/2024,-0.43,fee STRIPE-A2NHR3EA txn_3QAvchGtEGgLrOja09zeUbdv Youth Class 6-9
17/10/2024,0.00,stripe debit STRIPE-MIDM4E6G po_1QA0RmGtEGgLrOja97FiwO44
18/10/2024,15.00,sale STRIPE-U5MKWT8V txn_3QBIlQGtEGgLrOja1mj1JjPA Youth Class 10-14
18/10/2024,-0.43,fee STRIPE-U5MKWT8V txn_3QBIlQGtEGgLrOja1mj1JjPA Youth Class 10-14
18/10/2024,15.00,sale STRIPE-U5MKWT8V txn_3QBM3hGtEGgLrOja1cxNNW18 Youth Class East 8-14
18/10/2024,-0.43,fee STRIPE-U5MKWT8V txn_3QBM3hGtEGgLrOja1cxNNW18 Youth Class East 8-14
18/10/2024,10.00,sale STRIPE-U5MKWT8V txn_3QBNL4GtEGgLrOja0fjxNDGH Outdoor Class East
18/10/2024,-0.35,fee STRIPE-U5MKWT8V txn_3QBNL4GtEGgLrOja0fjxNDGH Outdoor Class East
19/10/2024,10.00,sale STRIPE-AIXXIQZF txn_3QBXOIGtEGgLrOja0lKlFsme Outdoor Class East
19/10/2024,-0.35,fee STRIPE-AIXXIQZF txn_3QBXOIGtEGgLrOja0lKlFsme Outdoor Class East
19/10/2024,10.00,sale STRIPE-AIXXIQZF txn_3QBYTBGtEGgLrOja0IzCB9TX Outdoor Class East
19/10/2024,-0.35,fee STRIPE-AIXXIQZF txn_3QBYTBGtEGgLrOja0IzCB9TX Outdoor Class East
19/10/2024,15.00,sale STRIPE-AIXXIQZF txn_3QBaJiGtEGgLrOja0Bgxey0U Youth Class 10-14
19/10/2024,-0.43,fee STRIPE-AIXXIQZF txn_3QBaJiGtEGgLrOja0Bgxey0U Youth Class 10-14
19/10/2024,15.00,sale STRIPE-AIXXIQZF txn_3QBcJcGtEGgLrOja0zOMfDez Youth Class 10-14
19/10/2024,-0.43,fee STRIPE-AIXXIQZF txn_3QBcJcGtEGgLrOja0zOMfDez Youth Class 10-14
19/10/2024,10.00,sale STRIPE-AIXXIQZF txn_3QBiCVGtEGgLrOja0Ytd1dqH Outdoor Class North
19/10/2024,-0.35,fee STRIPE-AIXXIQZF txn_3QBiCVGtEGgLrOja0Ytd1dqH Outdoor Class North
19/10/2024,15.00,sale STRIPE-AIXXIQZF txn_3QBjqiGtEGgLrOja06MXtZUy Youth Class 6-9
19/10/2024,-0.43,fee STRIPE-AIXXIQZF txn_3QBjqiGtEGgLrOja06MXtZUy Youth Class 6-9
20/10/2024,15.00,sale STRIPE-AIXXIQZF txn_3QBrrxGtEGgLrOja1wjHquxM Youth Class 6-9
20/10/2024,-0.43,fee STRIPE-AIXXIQZF txn_3QBrrxGtEGgLrOja1wjHquxM Youth Class 6-9
20/10/2024,15.00,sale STRIPE-AIXXIQZF txn_3QBuEkGtEGgLrOja0qS0oOly Youth Class 10-14
20/10/2024,-0.43,fee STRIPE-AIXXIQZF txn_3QBuEkGtEGgLrOja0qS0oOly Youth Class 10-14
20/10/2024,10.00,sale STRIPE-AIXXIQZF txn_3QBvBFGtEGgLrOja0XHyaT66 Outdoor Class North
20/10/2024,-0.35,fee STRIPE-AIXXIQZF txn_3QBvBFGtEGgLrOja0XHyaT66 Outdoor Class North
21/10/2024,20.00,sale STRIPE-AIXXIQZF txn_3QCOcbGtEGgLrOja0VEHDiIG Outdoor Class East
21/10/2024,-0.44,fee STRIPE-AIXXIQZF txn_3QCOcbGtEGgLrOja0VEHDiIG Outdoor Class East
22/10/2024,0.00,stripe debit STRIPE-A2NHR3EA po_1QCWoWGtEGgLrOjaMAijuYUd
23/10/2024,60.00,sale STRIPE-WTFFWX6C txn_3QD1n2GtEGgLrOja08dcmpKr Private Booking
23/10/2024,-1.10,fee STRIPE-WTFFWX6C txn_3QD1n2GtEGgLrOja08dcmpKr Private Booking
23/10/2024,10.00,sale STRIPE-WTFFWX6C txn_3QD4o0GtEGgLrOja1tX4fVJr Outdoor Class East
23/10/2024,-0.35,fee STRIPE-WTFFWX6C txn_3QD4o0GtEGgLrOja1tX4fVJr Outdoor Class East
23/10/2024,0.00,stripe debit STRIPE-U5MKWT8V po_1QCtXrGtEGgLrOjav7jYisHp
24/10/2024,10.00,sale STRIPE-NDIQ0ZIJ txn_3QDLIKGtEGgLrOja16UhuyML Gift Card 1
24/10/2024,-0.53,fee STRIPE-NDIQ0ZIJ txn_3QDLIKGtEGgLrOja16UhuyML Gift Card 1
24/10/2024,0.00,stripe debit STRIPE-AIXXIQZF po_1QDFfkGtEGgLrOjavPpSTLQc
25/10/2024,10.00,sale STRIPE-1JZEHWTS txn_3QDiiRGtEGgLrOja1CmBcbe3 Outdoor Class East
25/10/2024,-0.35,fee STRIPE-1JZEHWTS txn_3QDiiRGtEGgLrOja1CmBcbe3 Outdoor Class East
25/10/2024,10.00,sale STRIPE-1JZEHWTS txn_3QDjhOGtEGgLrOja1zdR1Wr6 Outdoor Class East
25/10/2024,-0.35,fee STRIPE-1JZEHWTS txn_3QDjhOGtEGgLrOja1zdR1Wr6 Outdoor Class East
25/10/2024,10.00,sale STRIPE-1JZEHWTS txn_3QDlaKGtEGgLrOja0o6pXogF Outdoor Class East
25/10/2024,-0.35,fee STRIPE-1JZEHWTS txn_3QDlaKGtEGgLrOja0o6pXogF Outdoor Class East
26/10/2024,40.00,sale STRIPE-1JZEHWTS txn_3QDwbiGtEGgLrOja1mNtXYk7 custom
26/10/2024,-0.80,fee STRIPE-1JZEHWTS txn_3QDwbiGtEGgLrOja1mNtXYk7 custom
26/10/2024,10.00,sale STRIPE-1JZEHWTS txn_3QDwc3GtEGgLrOja01bKmMaw Outdoor Class East
26/10/2024,-0.35,fee STRIPE-1JZEHWTS txn_3QDwc3GtEGgLrOja01bKmMaw Outdoor Class East
26/10/2024,100.00,sale STRIPE-Q5U5VKIT txn_3QE4dbGtEGgLrOja0Z3r8cqp Gift Card 11
26/10/2024,-1.70,fee STRIPE-Q5U5VKIT txn_3QE4dbGtEGgLrOja0Z3r8cqp Gift Card 11
26/10/2024,10.00,sale STRIPE-Q5U5VKIT txn_3QE4e1GtEGgLrOja1dkdluno Outdoor Class East
26/10/2024,-0.35,fee STRIPE-Q5U5VKIT txn_3QE4e1GtEGgLrOja1dkdluno Outdoor Class East
26/10/2024,10.00,sale STRIPE-Q5U5VKIT txn_3QE541GtEGgLrOja0ma8tmSO Outdoor Class East
26/10/2024,-0.35,fee STRIPE-Q5U5VKIT txn_3QE541GtEGgLrOja0ma8tmSO Outdoor Class East
27/10/2024,15.00,sale STRIPE-Q5U5VKIT txn_3QEbKVGtEGgLrOja1KnWJyjU Youth Class 6-9
27/10/2024,-0.43,fee STRIPE-Q5U5VKIT txn_3QEbKVGtEGgLrOja1KnWJyjU Youth Class 6-9
28/10/2024,10.00,sale STRIPE-Q5U5VKIT txn_3QEsCJGtEGgLrOja1tYOYeEl Outdoor Class North
28/10/2024,-0.35,fee STRIPE-Q5U5VKIT txn_3QEsCJGtEGgLrOja1tYOYeEl Outdoor Class North
28/10/2024,0.00,stripe debit STRIPE-WTFFWX6C po_1QEhvRGtEGgLrOjarUf2Hgbu
29/10/2024,15.00,sale STRIPE-WJFYYJHW txn_3QFBATGtEGgLrOja1D4Fx6Yz Youth Class 6-9
29/10/2024,-0.43,fee STRIPE-WJFYYJHW txn_3QFBATGtEGgLrOja1D4Fx6Yz Youth Class 6-9
29/10/2024,0.00,stripe debit STRIPE-NDIQ0ZIJ po_1QF42dGtEGgLrOjaKdRv5pdZ
30/10/2024,20.00,sale STRIPE-K9IR0MWN txn_3QFZA8GtEGgLrOja0hnOnSh9 Outdoor Class East
30/10/2024,-0.50,fee STRIPE-K9IR0MWN txn_3QFZA8GtEGgLrOja0hnOnSh9 Outdoor Class East
30/10/2024,60.00,sale STRIPE-K9IR0MWN txn_3QFbP8GtEGgLrOja1DOI4Qa9 Private Booking
30/10/2024,-1.10,fee STRIPE-K9IR0MWN txn_3QFbP8GtEGgLrOja1DOI4Qa9 Private Booking
30/10/2024,375.00,sale STRIPE-K9IR0MWN txn_3QFiC0GtEGgLrOja1CoV0ae3 custom
30/10/2024,-9.58,fee STRIPE-K9IR0MWN txn_3QFiC0GtEGgLrOja1CoV0ae3 custom
30/10/2024,0.00,stripe debit STRIPE-1JZEHWTS po_1QFQa0GtEGgLrOjauxpyYrwd
31/10/2024,10.00,sale STRIPE-WCTGMVKH txn_3QFuLfGtEGgLrOja0BW2X84g Outdoor Class East
31/10/2024,-0.35,fee STRIPE-WCTGMVKH txn_3QFuLfGtEGgLrOja0BW2X84g Outdoor Class East
31/10/2024,20.00,sale STRIPE-WCTGMVKH txn_3QFun6GtEGgLrOja1MTofTJx Outdoor Class East
31/10/2024,-0.50,fee STRIPE-WCTGMVKH txn_3QFun6GtEGgLrOja1MTofTJx Outdoor Class East
31/10/2024,0.00,stripe debit STRIPE-Q5U5VKIT po_1QFn9eGtEGgLrOjaxuzF9NMX
01/11/2024,10.00,sale STRIPE-GKG1291Y txn_3QGAfqGtEGgLrOja0XobOp71 Outdoor Class East
01/11/2024,-0.35,fee STRIPE-GKG1291Y txn_3QGAfqGtEGgLrOja0XobOp71 Outdoor Class East
01/11/2024,15.00,sale STRIPE-GKG1291Y txn_3QGHeSGtEGgLrOja05fHbvA5 Youth Class 10-14
01/11/2024,-0.43,fee STRIPE-GKG1291Y txn_3QGHeSGtEGgLrOja05fHbvA5 Youth Class 10-14
01/11/2024,15.00,sale STRIPE-GKG1291Y txn_3QGJJnGtEGgLrOja1NSzRLzV Youth Class East 8-14
01/11/2024,-0.43,fee STRIPE-GKG1291Y txn_3QGJJnGtEGgLrOja1NSzRLzV Youth Class East 8-14
01/11/2024,10.00,sale STRIPE-GKG1291Y txn_3QGN4CGtEGgLrOja0xRGLaYN Outdoor Class East
01/11/2024,-0.35,fee STRIPE-GKG1291Y txn_3QGN4CGtEGgLrOja0xRGLaYN Outdoor Class East
01/11/2024,15.00,sale STRIPE-GKG1291Y txn_3QGOzvGtEGgLrOja06CDIG0i Youth Class East 8-14
01/11/2024,-0.43,fee STRIPE-GKG1291Y txn_3QGOzvGtEGgLrOja06CDIG0i Youth Class East 8-14
01/11/2024,10.00,sale STRIPE-GKG1291Y txn_3QGPaDGtEGgLrOja1zJDSynB Outdoor Class East
01/11/2024,-0.35,fee STRIPE-GKG1291Y txn_3QGPaDGtEGgLrOja1zJDSynB Outdoor Class East
01/11/2024,15.00,sale STRIPE-GKG1291Y txn_3QGQ5YGtEGgLrOja0Ev7mZzj Youth Class East 8-14
01/11/2024,-0.43,fee STRIPE-GKG1291Y txn_3QGQ5YGtEGgLrOja0Ev7mZzj Youth Class East 8-14
01/11/2024,0.00,stripe debit STRIPE-WJFYYJHW po_1QG9h8GtEGgLrOjaE0AM1rJP
02/11/2024,10.00,sale STRIPE-HMAKSXNM txn_3QGVYXGtEGgLrOja1JJ1nppA Outdoor Class East
02/11/2024,-0.35,fee STRIPE-HMAKSXNM txn_3QGVYXGtEGgLrOja1JJ1nppA Outdoor Class East
02/11/2024,40.00,sale STRIPE-HMAKSXNM txn_3QGVZ3GtEGgLrOja19tTx5SG custom
02/11/2024,-0.80,fee STRIPE-HMAKSXNM txn_3QGVZ3GtEGgLrOja19tTx5SG custom
02/11/2024,10.00,sale STRIPE-HMAKSXNM txn_3QGcHFGtEGgLrOja050r8R0V Outdoor Class East
02/11/2024,-0.35,fee STRIPE-HMAKSXNM txn_3QGcHFGtEGgLrOja050r8R0V Outdoor Class East
02/11/2024,10.00,sale STRIPE-HMAKSXNM txn_3QGddeGtEGgLrOja0XqQBvoM Outdoor Class East
02/11/2024,-0.35,fee STRIPE-HMAKSXNM txn_3QGddeGtEGgLrOja0XqQBvoM Outdoor Class East
02/11/2024,10.00,sale STRIPE-HMAKSXNM txn_3QGdeMGtEGgLrOja1Jt9Dfd9 Outdoor Class East
02/11/2024,-0.35,fee STRIPE-HMAKSXNM txn_3QGdeMGtEGgLrOja1Jt9Dfd9 Outdoor Class East
02/11/2024,10.00,sale STRIPE-HMAKSXNM txn_3QGdyDGtEGgLrOja18D2zBNH Outdoor Class East
02/11/2024,-0.35,fee STRIPE-HMAKSXNM txn_3QGdyDGtEGgLrOja18D2zBNH Outdoor Class East
02/11/2024,15.00,sale STRIPE-HMAKSXNM txn_3QGkmdGtEGgLrOja1pgTa4wz Youth Class 10-14
02/11/2024,-0.43,fee STRIPE-HMAKSXNM txn_3QGkmdGtEGgLrOja1pgTa4wz Youth Class 10-14
02/11/2024,10.00,sale STRIPE-HMAKSXNM txn_3QGmbEGtEGgLrOja1W8Q7efo Outdoor Class North
02/11/2024,-0.35,fee STRIPE-HMAKSXNM txn_3QGmbEGtEGgLrOja1W8Q7efo Outdoor Class North
02/11/2024,10.00,sale STRIPE-HMAKSXNM txn_3QGoZzGtEGgLrOja0ppy5Ia0 Outdoor Class North
02/11/2024,-0.35,fee STRIPE-HMAKSXNM txn_3QGoZzGtEGgLrOja0ppy5Ia0 Outdoor Class North
03/11/2024,10.00,sale STRIPE-HMAKSXNM txn_3QGrFYGtEGgLrOja1VR3k2Fm Outdoor Class North
03/11/2024,-0.45,fee STRIPE-HMAKSXNM txn_3QGrFYGtEGgLrOja1VR3k2Fm Outdoor Class North
03/11/2024,15.00,sale STRIPE-HMAKSXNM txn_3QGzDlGtEGgLrOja0w9rarBF Youth Class 6-9
03/11/2024,-0.43,fee STRIPE-HMAKSXNM txn_3QGzDlGtEGgLrOja0w9rarBF Youth Class 6-9
03/11/2024,10.00,sale STRIPE-HMAKSXNM txn_3QGzS5GtEGgLrOja11xYse5s Outdoor Class North
03/11/2024,-0.35,fee STRIPE-HMAKSXNM txn_3QGzS5GtEGgLrOja11xYse5s Outdoor Class North
03/11/2024,15.00,sale STRIPE-HMAKSXNM txn_3QH2g4GtEGgLrOja1IKKuQXh Youth Class 6-9
03/11/2024,-0.43,fee STRIPE-HMAKSXNM txn_3QH2g4GtEGgLrOja1IKKuQXh Youth Class 6-9
03/11/2024,15.00,sale STRIPE-HMAKSXNM txn_3QH2i2GtEGgLrOja05TL8Tgn Youth Class 6-9
03/11/2024,-0.43,fee STRIPE-HMAKSXNM txn_3QH2i2GtEGgLrOja05TL8Tgn Youth Class 6-9
03/11/2024,15.00,sale STRIPE-HMAKSXNM txn_3QH38gGtEGgLrOja0qlFEhrk Youth Class 6-9
03/11/2024,-0.43,fee STRIPE-HMAKSXNM txn_3QH38gGtEGgLrOja0qlFEhrk Youth Class 6-9
04/11/2024,0.00,stripe debit STRIPE-K9IR0MWN po_1QHFLOGtEGgLrOja2iObDrsY
05/11/2024,50.00,refund STRIPE-GKG1291Y txn_3Q7KUSGtEGgLrOja0DfRlGHH Gift Card 5
05/11/2024,15.00,refund STRIPE-HMAKSXNM txn_3QH2i2GtEGgLrOja0V0mpgkQ Youth Class 6-9
05/11/2024,0.00,stripe debit STRIPE-WCTGMVKH po_1QHbQmGtEGgLrOjaZ5lT16Gw
06/11/2024,15.00,sale STRIPE-LB2XF6XS txn_3QI5r6GtEGgLrOja0h4aOEhs Youth Class 10-14
06/11/2024,-0.43,fee STRIPE-LB2XF6XS txn_3QI5r6GtEGgLrOja0h4aOEhs Youth Class 10-14
06/11/2024,15.00,sale STRIPE-LB2XF6XS txn_3QI7LiGtEGgLrOja1UIBftFn Youth Class 6-9
06/11/2024,-0.43,fee STRIPE-LB2XF6XS txn_3QI7LiGtEGgLrOja1UIBftFn Youth Class 6-9
06/11/2024,60.00,sale STRIPE-LB2XF6XS txn_3QI8G3GtEGgLrOja0hyngOG8 Private Booking
06/11/2024,-1.10,fee STRIPE-LB2XF6XS txn_3QI8G3GtEGgLrOja0hyngOG8 Private Booking
06/11/2024,0.00,stripe debit STRIPE-GKG1291Y po_1QHxq1GtEGgLrOjaBSly6Nwq
07/11/2024,0.00,stripe debit STRIPE-HMAKSXNM po_1QIK9EGtEGgLrOjapC9r8CDR
08/11/2024,15.00,sale STRIPE-GY5KR59F txn_3QIs4FGtEGgLrOja17Yq0DHQ Youth Class East 8-14
08/11/2024,-0.43,fee STRIPE-GY5KR59F txn_3QIs4FGtEGgLrOja17Yq0DHQ Youth Class East 8-14
08/11/2024,15.00,sale STRIPE-GY5KR59F txn_3QIv3PGtEGgLrOja0Ahfsk4W Youth Class 10-14
08/11/2024,-0.43,fee STRIPE-GY5KR59F txn_3QIv3PGtEGgLrOja0Ahfsk4W Youth Class 10-14
08/11/2024,15.00,sale STRIPE-GY5KR59F txn_3QIv3uGtEGgLrOja04yDwpnP Youth Class 10-14
08/11/2024,-0.43,fee STRIPE-GY5KR59F txn_3QIv3uGtEGgLrOja04yDwpnP Youth Class 10-14
08/11/2024,15.00,refund STRIPE-GY5KR59F txn_3QIv3uGtEGgLrOja0mtEWqKH Youth Class 10-14
08/11/2024,10.00,sale STRIPE-GY5KR59F txn_3QIwnBGtEGgLrOja0UrvYIph Outdoor Class East
08/11/2024,-0.35,fee STRIPE-GY5KR59F txn_3QIwnBGtEGgLrOja0UrvYIph Outdoor Class East
08/11/2024,10.00,sale STRIPE-GY5KR59F txn_3QIzNqGtEGgLrOja0EOQsz5w Outdoor Class East
08/11/2024,-0.35,fee STRIPE-GY5KR59F txn_3QIzNqGtEGgLrOja0EOQsz5w Outdoor Class East
08/11/2024,15.00,sale STRIPE-GY5KR59F txn_3QJ0AZGtEGgLrOja15kWi84Z Youth Class 10-14
08/11/2024,-0.43,fee STRIPE-GY5KR59F txn_3QJ0AZGtEGgLrOja15kWi84Z Youth Class 10-14
09/11/2024,10.00,sale STRIPE-LJVKBO0S txn_3QJAlkGtEGgLrOja0yOrkIew Outdoor Class East
09/11/2024,-0.35,fee STRIPE-LJVKBO0S txn_3QJAlkGtEGgLrOja0yOrkIew Outdoor Class East
09/11/2024,15.00,sale STRIPE-LJVKBO0S txn_3QJFYBGtEGgLrOja1aTMlfGC Youth Class 10-14
09/11/2024,-0.43,fee STRIPE-LJVKBO0S txn_3QJFYBGtEGgLrOja1aTMlfGC Youth Class 10-14
09/11/2024,30.00,sale STRIPE-LJVKBO0S txn_3QJKqdGtEGgLrOja1zSjlLwS Youth Class 10-14
09/11/2024,-0.65,fee STRIPE-LJVKBO0S txn_3QJKqdGtEGgLrOja1zSjlLwS Youth Class 10-14
09/11/2024,15.00,sale STRIPE-LJVKBO0S txn_3QJLX6GtEGgLrOja1pzJ8YNn Youth Class 6-9
09/11/2024,-0.43,fee STRIPE-LJVKBO0S txn_3QJLX6GtEGgLrOja1pzJ8YNn Youth Class 6-9
09/11/2024,30.00,sale STRIPE-LJVKBO0S txn_3QJNDVGtEGgLrOja006eQOP8 Youth Class 6-9
09/11/2024,-0.65,fee STRIPE-LJVKBO0S txn_3QJNDVGtEGgLrOja006eQOP8 Youth Class 6-9
10/11/2024,15.00,sale STRIPE-LJVKBO0S txn_3QJOqjGtEGgLrOja0s16MIBS Youth Class 6-9
10/11/2024,-0.43,fee STRIPE-LJVKBO0S txn_3QJOqjGtEGgLrOja0s16MIBS Youth Class 6-9
10/11/2024,15.00,sale STRIPE-LJVKBO0S txn_3QJOrJGtEGgLrOja131I7fuS Youth Class 10-14
10/11/2024,-0.43,fee STRIPE-LJVKBO0S txn_3QJOrJGtEGgLrOja131I7fuS Youth Class 10-14
10/11/2024,15.00,sale STRIPE-LJVKBO0S txn_3QJWpJGtEGgLrOja04ATkIFK Youth Class 6-9
10/11/2024,-0.43,fee STRIPE-LJVKBO0S txn_3QJWpJGtEGgLrOja04ATkIFK Youth Class 6-9
10/11/2024,15.00,sale STRIPE-LJVKBO0S txn_3QJWsZGtEGgLrOja0SnI0fM9 Youth Class 6-9
10/11/2024,-0.43,fee STRIPE-LJVKBO0S txn_3QJWsZGtEGgLrOja0SnI0fM9 Youth Class 6-9
11/11/2024,15.00,sale STRIPE-LJVKBO0S txn_3QK0aBGtEGgLrOja02b7uHLj Youth Class 6-9
11/11/2024,-0.43,fee STRIPE-LJVKBO0S txn_3QK0aBGtEGgLrOja02b7uHLj Youth Class 6-9
11/11/2024,15.00,sale STRIPE-LJVKBO0S txn_3QK0bWGtEGgLrOja1yAH1eqi Youth Class 6-9
11/11/2024,-0.43,fee STRIPE-LJVKBO0S txn_3QK0bWGtEGgLrOja1yAH1eqi Youth Class 6-9
11/11/2024,0.00,stripe debit STRIPE-LB2XF6XS po_1QJmUMGtEGgLrOja59Hy9VHz
12/11/2024,10.00,sale STRIPE-G3IUTC2V txn_3QKMwZGtEGgLrOja1nQrdMVb Outdoor Class East
12/11/2024,-0.35,fee STRIPE-G3IUTC2V txn_3QKMwZGtEGgLrOja1nQrdMVb Outdoor Class East
13/11/2024,60.00,sale STRIPE-4OSE9KQ1 txn_3QKg2lGtEGgLrOja18UtIhOU Private Booking
13/11/2024,-1.10,fee STRIPE-4OSE9KQ1 txn_3QKg2lGtEGgLrOja18UtIhOU Private Booking
13/11/2024,0.00,stripe debit STRIPE-GY5KR59F po_1QKVUIGtEGgLrOjatHk4hKqW
14/11/2024,0.00,stripe debit STRIPE-LJVKBO0S po_1QKrs2GtEGgLrOjaAqoDdvxO
15/11/2024,10.00,sale STRIPE-EUTSUZMB txn_3QLRRwGtEGgLrOja1CHRUaQo Outdoor Class East
15/11/2024,-0.35,fee STRIPE-EUTSUZMB txn_3QLRRwGtEGgLrOja1CHRUaQo Outdoor Class East
15/11/2024,10.00,sale STRIPE-EUTSUZMB txn_3QLRlxGtEGgLrOja1W0TnmEq Outdoor Class East
15/11/2024,-0.35,fee STRIPE-EUTSUZMB txn_3QLRlxGtEGgLrOja1W0TnmEq Outdoor Class East
15/11/2024,15.00,sale STRIPE-EUTSUZMB txn_3QLXwwGtEGgLrOja1q3rOuRd Youth Class East 8-14
15/11/2024,-0.43,fee STRIPE-EUTSUZMB txn_3QLXwwGtEGgLrOja1q3rOuRd Youth Class East 8-14
15/11/2024,40.00,sale STRIPE-EUTSUZMB txn_3QLYnlGtEGgLrOja1MW1FzzK custom
15/11/2024,-0.80,fee STRIPE-EUTSUZMB txn_3QLYnlGtEGgLrOja1MW1FzzK custom
15/11/2024,10.00,sale STRIPE-EUTSUZMB txn_3QLYoEGtEGgLrOja1uyF1hoC Outdoor Class East
15/11/2024,-0.35,fee STRIPE-EUTSUZMB txn_3QLYoEGtEGgLrOja1uyF1hoC Outdoor Class East
15/11/2024,0.00,stripe debit STRIPE-G3IUTC2V po_1QLETuGtEGgLrOjavPi4Op20
16/11/2024,10.00,sale STRIPE-XLUWBWBX txn_3QLhERGtEGgLrOja0wETivhJ Outdoor Class East
16/11/2024,-0.35,fee STRIPE-XLUWBWBX txn_3QLhERGtEGgLrOja0wETivhJ Outdoor Class East
16/11/2024,10.00,sale STRIPE-XLUWBWBX txn_3QLi9gGtEGgLrOja0o5Qrg6f Outdoor Class East
